,activity,basket_amount,bonus_credit_eligibility,borrowers,description.languages,description.texts.en,description.texts.fr,description.texts.pt,funded_amount,funded_date,id,image.id,image.template_id,journal_totals.bulkEntries,journal_totals.entries,lender_count,loan_amount,location.country,location.country_code,location.geo.level,location.geo.pairs,location.geo.type,location.town,name,partner_id,payments,planned_expiration_date,posted_date,sector,status,tags,terms.disbursal_amount,terms.disbursal_currency,terms.disbursal_date,terms.loan_amount,terms.local_payments,terms.loss_liability.currency_exchange,terms.loss_liability.currency_exchange_coverage_rate,terms.loss_liability.nonpayment,terms.repayment_interval,terms.repayment_term,terms.scheduled_payments,themes,translator.byline,translator.image,use
0,Home Energy,0.0,True,"[{'first_name': 'Everline ', 'last_name': '', 'gender': 'F', 'pictured': True}]",['en'],"Hello Kiva Community! <br /><br />Meet Everline who is a crop and animal farmer and, a mother eager to provide the very best for her family. <br /><br />She states that with her small income, she hasn’t been able to provide sufficient lighting through the electricity in her home. Her family has been using kerosene lamps, despite the toxic fumes that put the family at risk of contracting respiratory diseases. <br /><br />Everline is kindly appealing for a loan to buy a solar lantern to provide adequate lighting, enabling her children to read well while at home. With the lantern’s dual charging capability, her husband will also be able to efficiently charge his phone. Kindly consider lending to her.",,,0,,1534067,2854262,1,0,0,0,100,Kenya,KE,town,0.948567 35.508461,point,Kapsowar,Everline,156,[],2018-06-26T04:20:06Z,2018-05-27T04:20:06Z,Personal Use,fundraising,"[{'name': '#Eco-friendly'}, {'name': '#Parent'}, {'name': '#Health and Sanitation'}, {'name': '#Technology'}]",9000.0,KES,2018-05-21T07:00:00Z,100,"[{'due_date': '2018-06-25T07:00:00Z', 'amount': 605.3}, {'due_date': '2018-07-25T07:00:00Z', 'amount': 658.05}, {'due_date': '2018-08-25T07:00:00Z', 'amount': 677.29}, {'due_date': '2018-09-25T07:00:00Z', 'amount': 697.08}, {'due_date': '2018-10-25T07:00:00Z', 'amount': 717.45}, {'due_date': '2018-11-25T08:00:00Z', 'amount': 738.42}, {'due_date': '2018-12-25T08:00:00Z', 'amount': 760}, {'due_date': '2019-01-25T08:00:00Z', 'amount': 782.21}, {'due_date': '2019-02-25T08:00:00Z', 'amount': 805.07}, {'due_date': '2019-03-25T07:00:00Z', 'amount': 828.6}, {'due_date': '2019-04-25T07:00:00Z', 'amount': 852.81}, {'due_date': '2019-05-25T07:00:00Z', 'amount': 877.72}]",shared,0.1,lender,Monthly,14,"[{'due_date': '2018-08-01T07:00:00Z', 'amount': 6.73}, {'due_date': '2018-09-01T07:00:00Z', 'amount': 7.31}, {'due_date': '2018-10-01T07:00:00Z', 'amount': 7.53}, {'due_date': '2018-11-01T07:00:00Z', 'amount': 7.75}, {'due_date': '2018-12-01T08:00:00Z', 'amount': 7.97}, {'due_date': '2019-01-01T08:00:00Z', 'amount': 8.2}, {'due_date': '2019-02-01T08:00:00Z', 'amount': 8.44}, {'due_date': '2019-03-01T08:00:00Z', 'amount': 8.69}, {'due_date': '2019-04-01T07:00:00Z', 'amount': 8.94}, {'due_date': '2019-05-01T07:00:00Z', 'amount': 9.21}, {'due_date': '2019-06-01T07:00:00Z', 'amount': 9.48}, {'due_date': '2019-07-01T07:00:00Z', 'amount': 9.75}]","['Clean Energy', 'Green', 'Solar', 'Earth Day Campaign']",,,"to buy a solar lantern to provide adequate lighting, enabling her children to read well while at home."
1,Primary/secondary school costs,0.0,True,"[{'first_name': 'Abby', 'last_name': '', 'gender': 'F', 'pictured': True}]",['en'],"Abby is a caring mom from the Eldoret area, which is a luxuriant maize- and dairy-producing region in the Rift Valley Province of Kenya. She's very passionate, hardworking and eager to learn and take on new challenges.<br /><br />These qualities have propelled her to be one of the most respected farmers in her village. She sells milk, poultry, maize and vegetables produced on her farm. She also has a personal business to make ends meet. <br /><br />Abby is a go-getter and has a great desire to succeed in life. Of all her activities, dairy farming is closest to her heart. She enjoys waking up every morning to milk her cows and feed them with fodder that has a high nutrient value. She's so keen and close to her cows that she's named them, which makes Abby very proud. She feels fulfilled. <br /><br />Abby is seeking an education loan to pay tuition fees for her youngest children, who are still in school. <br /><br />She believes the knowledge and skills her children will get from school will help them to have a brighter future. Through education, her children will secure good jobs and be able to build good, modern houses. <br /><br />Lend $25 or more toward this loan and empower her children’s lives.",,,0,,1534061,2854252,1,0,0,0,225,Kenya,KE,town,0.516667 35.283333,point,Eldoret,Abby,156,[],2018-06-26T04:00:03Z,2018-05-27T04:00:03Z,Education,fundraising,[{'name': '#Schooling'}],21105.0,KES,2018-05-21T07:00:00Z,225,"[{'due_date': '2018-06-21T07:00:00Z', 'amount': 1499.53}, {'due_date': '2018-07-21T07:00:00Z', 'amount': 1542.32}, {'due_date': '2018-08-21T07:00:00Z', 'amount': 1586.33}, {'due_date': '2018-09-21T07:00:00Z', 'amount': 1631.59}, {'due_date': '2018-10-21T07:00:00Z', 'amount': 1678.15}, {'due_date': '2018-11-21T08:00:00Z', 'amount': 1726.03}, {'due_date': '2018-12-21T08:00:00Z', 'amount': 1775.28}, {'due_date': '2019-01-21T08:00:00Z', 'amount': 1825.93}, {'due_date': '2019-02-21T08:00:00Z', 'amount': 1878.03}, {'due_date': '2019-03-21T07:00:00Z', 'amount': 1931.62}, {'due_date': '2019-04-21T07:00:00Z', 'amount': 1986.74}, {'due_date': '2019-05-21T07:00:00Z', 'amount': 2043.45}]",shared,0.1,lender,Monthly,14,"[{'due_date': '2018-08-01T07:00:00Z', 'amount': 15.99}, {'due_date': '2018-09-01T07:00:00Z', 'amount': 16.44}, {'due_date': '2018-10-01T07:00:00Z', 'amount': 16.91}, {'due_date': '2018-11-01T07:00:00Z', 'amount': 17.39}, {'due_date': '2018-12-01T08:00:00Z', 'amount': 17.89}, {'due_date': '2019-01-01T08:00:00Z', 'amount': 18.4}, {'due_date': '2019-02-01T08:00:00Z', 'amount': 18.93}, {'due_date': '2019-03-01T08:00:00Z', 'amount': 19.47}, {'due_date': '2019-04-01T07:00:00Z', 'amount': 20.02}, {'due_date': '2019-05-01T07:00:00Z', 'amount': 20.59}, {'due_date': '2019-06-01T07:00:00Z', 'amount': 21.18}, {'due_date': '2019-07-01T07:00:00Z', 'amount': 21.79}]",,,,"to pay tuition fees for her youngest children, who are still in school."
2,Home Energy,25.0,True,"[{'first_name': 'Hellen', 'last_name': '', 'gender': 'F', 'pictured': True}]",['en'],"Hello Kiva Community! <br /><br />Meet Hellen, who is a crop and animal farmer, and a mother eager to provide the very best for her family. <br /><br />She states that with her small income, she hasn’t been able to provide sufficient lighting through the electricity in her home. Her family has been using kerosene lamps, despite the toxic fumes that put the family at risk of contracting respiratory diseases. <br /><br />Hellen is kindly appealing for a loan to buy a solar lantern to provide adequate lighting, enabling her children to read well while at home. With the lantern’s dual charging capability, her husband will also be able to efficiently charge his phone. <br /><br />Kindly consider lending to her.",,,0,,1534041,2854208,1,0,0,0,100,Kenya,KE,town,-0.785561 35.33914,point,Bomet,Hellen,156,[],2018-06-26T03:50:06Z,2018-05-27T03:50:06Z,Personal Use,fundraising,"[{'name': '#Eco-friendly'}, {'name': '#Parent'}, {'name': '#Health and Sanitation'}, {'name': '#Technology'}]",9000.0,KES,2018-05-21T07:00:00Z,100,"[{'due_date': '2018-06-25T07:00:00Z', 'amount': 636.96}, {'due_date': '2018-07-25T07:00:00Z', 'amount': 655.57}, {'due_date': '2018-08-25T07:00:00Z', 'amount': 674.73}, {'due_date': '2018-09-25T07:00:00Z', 'amount': 694.45}, {'due_date': '2018-10-25T07:00:00Z', 'amount': 714.74}, {'due_date': '2018-11-25T08:00:00Z', 'amount': 735.63}, {'due_date': '2018-12-25T08:00:00Z', 'amount': 757.13}, {'due_date': '2019-01-25T08:00:00Z', 'amount': 779.26}, {'due_date': '2019-02-25T08:00:00Z', 'amount': 802.03}, {'due_date': '2019-03-25T07:00:00Z', 'amount': 825.47}, {'due_date': '2019-04-25T07:00:00Z', 'amount': 849.6}, {'due_date': '2019-05-25T07:00:00Z', 'amount': 874.43}]",shared,0.1,lender,Monthly,14,"[{'due_date': '2018-08-01T07:00:00Z', 'amount': 7.08}, {'due_date': '2018-09-01T07:00:00Z', 'amount': 7.28}, {'due_date': '2018-10-01T07:00:00Z', 'amount': 7.5}, {'due_date': '2018-11-01T07:00:00Z', 'amount': 7.72}, {'due_date': '2018-12-01T08:00:00Z', 'amount': 7.94}, {'due_date': '2019-01-01T08:00:00Z', 'amount': 8.17}, {'due_date': '2019-02-01T08:00:00Z', 'amount': 8.41}, {'due_date': '2019-03-01T08:00:00Z', 'amount': 8.66}, {'due_date': '2019-04-01T07:00:00Z', 'amount': 8.91}, {'due_date': '2019-05-01T07:00:00Z', 'amount': 9.17}, {'due_date': '2019-06-01T07:00:00Z', 'amount': 9.44}, {'due_date': '2019-07-01T07:00:00Z', 'amount': 9.72}]","['Clean Energy', 'Green', 'Solar', 'Earth Day Campaign']",,,to buy a solar lantern.
3,Home Energy,25.0,True,"[{'first_name': 'Jane', 'last_name': '', 'gender': 'F', 'pictured': True}]",['en'],"Hello Kiva Community! <br /><br />Meet Jane, who is a crop and animal farmer, and a mother eager to provide the very best for her family. <br /><br />She states that with her small income, she hasn’t been able to provide sufficient lighting through the electricity in her home. Her family has been using kerosene lamps, despite the toxic fumes that put the family at risk of contracting respiratory diseases. <br /><br />Jane is kindly appealing for a loan to buy a solar lantern to provide adequate lighting, enabling her children to read well while at home. With the lantern’s dual charging capability, her husband will also be able to efficiently charge his phone. <br /><br />Kindly consider lending to her.",,,0,,1534037,2854205,1,0,0,0,100,Kenya,KE,town,-0.583333 35.183333,point,litein,Jane,156,[],2018-06-26T03:40:03Z,2018-05-27T03:40:03Z,Personal Use,fundraising,"[{'name': '#Eco-friendly'}, {'name': '#Parent'}, {'name': '#Health and Sanitation'}, {'name': '#Technology'}]",9000.0,KES,2018-05-21T07:00:00Z,100,"[{'due_date': '2018-06-30T07:00:00Z', 'amount': 636.96}, {'due_date': '2018-07-30T07:00:00Z', 'amount': 655.57}, {'due_date': '2018-08-30T07:00:00Z', 'amount': 674.73}, {'due_date': '2018-09-30T07:00:00Z', 'amount': 694.45}, {'due_date': '2018-10-30T07:00:00Z', 'amount': 714.74}, {'due_date': '2018-11-30T08:00:00Z', 'amount': 735.63}, {'due_date': '2018-12-30T08:00:00Z', 'amount': 757.13}, {'due_date': '2019-01-30T08:00:00Z', 'amount': 779.26}, {'due_date': '2019-02-28T08:00:00Z', 'amount': 802.03}, {'due_date': '2019-03-30T07:00:00Z', 'amount': 825.47}, {'due_date': '2019-04-30T07:00:00Z', 'amount': 849.6}, {'due_date': '2019-05-30T07:00:00Z', 'amount': 874.43}]",shared,0.1,lender,Monthly,14,"[{'due_date': '2018-08-01T07:00:00Z', 'amount': 7.08}, {'due_date': '2018-09-01T07:00:00Z', 'amount': 7.28}, {'due_date': '2018-10-01T07:00:00Z', 'amount': 7.5}, {'due_date': '2018-11-01T07:00:00Z', 'amount': 7.72}, {'due_date': '2018-12-01T08:00:00Z', 'amount': 7.94}, {'due_date': '2019-01-01T08:00:00Z', 'amount': 8.17}, {'due_date': '2019-02-01T08:00:00Z', 'amount': 8.41}, {'due_date': '2019-03-01T08:00:00Z', 'amount': 8.66}, {'due_date': '2019-04-01T07:00:00Z', 'amount': 8.91}, {'due_date': '2019-05-01T07:00:00Z', 'amount': 9.17}, {'due_date': '2019-06-01T07:00:00Z', 'amount': 9.44}, {'due_date': '2019-07-01T07:00:00Z', 'amount': 9.72}]","['Clean Energy', 'Green', 'Solar', 'Earth Day Campaign']",,,to buy a solar lantern.
4,Home Energy,25.0,True,"[{'first_name': 'Annah', 'last_name': '', 'gender': 'F', 'pictured': True}]",['en'],"Hello Kiva Community! <br /><br />Meet Annah, who is a crop and animal farmer, and a mother eager to provide the very best for her family. <br /><br />She states that with her small income, she hasn’t been able to provide sufficient lighting through the electricity in her home. Her family has been using kerosene lamps, despite the toxic fumes that put the family at risk of contracting respiratory diseases. <br /><br />Annah is kindly appealing for a loan to buy a solar lantern to provide adequate lighting, enabling her children to read well while at home. With the lantern’s dual charging capability, her husband will also be able to efficiently charge his phone. <br /><br />Kindly consider lending to her.",,,0,,1534044,2854222,1,0,0,0,100,Kenya,KE,town,-0.690674 35.111061,point,Sotik,Annah,156,[],2018-06-26T03:40:03Z,2018-05-27T03:40:03Z,Personal Use,fundraising,"[{'name': '#Eco-friendly'}, {'name': '#Parent'}, {'name': '#Health and Sanitation'}, {'name': '#Technology'}]",10000.0,KES,2018-05-21T07:00:00Z,100,"[{'due_date': '2018-06-30T07:00:00Z', 'amount': 707.73}, {'due_date': '2018-07-30T07:00:00Z', 'amount': 728.41}, {'due_date': '2018-08-30T07:00:00Z', 'amount': 749.7}, {'due_date': '2018-09-30T07:00:00Z', 'amount': 771.61}, {'due_date': '2018-10-30T07:00:00Z', 'amount': 794.16}, {'due_date': '2018-11-30T08:00:00Z', 'amount': 817.37}, {'due_date': '2018-12-30T08:00:00Z', 'amount': 841.26}, {'due_date': '2019-01-30T08:00:00Z', 'amount': 865.84}, {'due_date': '2019-02-28T08:00:00Z', 'amount': 891.15}, {'due_date': '2019-03-30T07:00:00Z', 'amount': 917.19}, {'due_date': '2019-04-30T07:00:00Z', 'amount': 944}, {'due_date': '2019-05-30T07:00:00Z', 'amount': 971.58}]",shared,0.1,lender,Monthly,14,"[{'due_date': '2018-08-01T07:00:00Z', 'amount': 7.08}, {'due_date': '2018-09-01T07:00:00Z', 'amount': 7.28}, {'due_date': '2018-10-01T07:00:00Z', 'amount': 7.5}, {'due_date': '2018-11-01T07:00:00Z', 'amount': 7.72}, {'due_date': '2018-12-01T08:00:00Z', 'amount': 7.94}, {'due_date': '2019-01-01T08:00:00Z', 'amount': 8.17}, {'due_date': '2019-02-01T08:00:00Z', 'amount': 8.41}, {'due_date': '2019-03-01T08:00:00Z', 'amount': 8.66}, {'due_date': '2019-04-01T07:00:00Z', 'amount': 8.91}, {'due_date': '2019-05-01T07:00:00Z', 'amount': 9.17}, {'due_date': '2019-06-01T07:00:00Z', 'amount': 9.44}, {'due_date': '2019-07-01T07:00:00Z', 'amount': 9.72}]","['Clean Energy', 'Green', 'Solar', 'Earth Day Campaign']",,,to buy a solar lantern.
5,Primary/secondary school costs,0.0,True,"[{'first_name': 'Jane', 'last_name': '', 'gender': 'F', 'pictured': True}]",['en'],"Jane is honest and hardworking. She adores her family and will do anything to keep them from going to bed hungry. She is from the Eldoret area of Kenya. She did not have the opportunity to advance her education to get a white-collar job. <br /><br />Jane plans to succeed in life and has farmed for 12 years. She is experienced and has many farming techniques at her fingertips. She practices animal and crop farming to take care of her family's needs and provide a good education. She believes that education is the key to success for her children. <br /><br />Jane requested a loan, which she will use to pay the school fees for her children. With the loan, her children will learn comfortably, and they will never be sent away because of a lack of tuition fees. Jane wants her children to have a bright future, and with this loan, she will be able to achieve this.",,,0,,1534056,2854241,1,0,0,0,75,Kenya,KE,town,0.516667 35.283333,point,Eldoret,Jane,156,[],2018-06-26T03:40:03Z,2018-05-27T03:40:03Z,Education,fundraising,"[{'name': 'user_favorite'}, {'name': '#Schooling'}]",7000.0,KES,2018-05-21T07:00:00Z,75,"[{'due_date': '2018-06-21T07:00:00Z', 'amount': 497.36}, {'due_date': '2018-07-21T07:00:00Z', 'amount': 511.55}, {'due_date': '2018-08-21T07:00:00Z', 'amount': 526.14}, {'due_date': '2018-09-21T07:00:00Z', 'amount': 541.16}, {'due_date': '2018-10-21T07:00:00Z', 'amount': 556.6}, {'due_date': '2018-11-21T08:00:00Z', 'amount': 572.48}, {'due_date': '2018-12-21T08:00:00Z', 'amount': 588.81}, {'due_date': '2019-01-21T08:00:00Z', 'amount': 605.62}, {'due_date': '2019-02-21T08:00:00Z', 'amount': 622.9}, {'due_date': '2019-03-21T07:00:00Z', 'amount': 640.67}, {'due_date': '2019-04-21T07:00:00Z', 'amount': 658.95}, {'due_date': '2019-05-21T07:00:00Z', 'amount': 677.76}]",shared,0.1,lender,Monthly,14,"[{'due_date': '2018-08-01T07:00:00Z', 'amount': 5.33}, {'due_date': '2018-09-01T07:00:00Z', 'amount': 5.48}, {'due_date': '2018-10-01T07:00:00Z', 'amount': 5.64}, {'due_date': '2018-11-01T07:00:00Z', 'amount': 5.8}, {'due_date': '2018-12-01T08:00:00Z', 'amount': 5.96}, {'due_date': '2019-01-01T08:00:00Z', 'amount': 6.13}, {'due_date': '2019-02-01T08:00:00Z', 'amount': 6.31}, {'due_date': '2019-03-01T08:00:00Z', 'amount': 6.49}, {'due_date': '2019-04-01T07:00:00Z', 'amount': 6.67}, {'due_date': '2019-05-01T07:00:00Z', 'amount': 6.87}, {'due_date': '2019-06-01T07:00:00Z', 'amount': 7.06}, {'due_date': '2019-07-01T07:00:00Z', 'amount': 7.26}]",,,,to pay the school fees for her children.
6,Pharmacy,0.0,False,"[{'first_name': 'Véronique', 'last_name': '', 'gender': 'F', 'pictured': True}, {'first_name': 'Anaclet', 'last_name': '', 'gender': 'M', 'pictured': True}]","['fr', 'en']","Veronique says: ""I have been running a pharmacy for 12 years now. I received my starting capital from my husband, who also happens to be trained as a nurse.<br /><br />The revenues from this business have really helped us to improve our living conditions, and to pay for our children's education and food. Thanks to this loan, I will stock up various pharmaceutical products with the goal of meeting customer demand and improving my revenues.""","J'exploite une pharmacie voilà maintenant 12 ans"", nous confie Véronique. ""Le fond de démarrage, je l'ai reçu de mon mari qui est aussi infirmier de formation.
Les revenus émanant de cette activité nous a beaucoup aidé dans l'amélioration de notre habitat, les études des enfants et la nourriture.
Avec ce crédit, je vais m'approvisionner en divers produits pharmaceutiques nécessaires afin d'essayer de satisfaire ma clientèle et d'améliorer mes revenus.""
",,0,,1535829,2856351,1,0,0,0,1500,Congo (DRC),CD,town,-2.515475 28.852398,point,KADUTU,Famille Byamoto Group,402,[],2018-06-25T23:40:08Z,2018-05-26T23:40:08Z,Health,fundraising,"[{'name': 'volunteer_like'}, {'name': '#Health and Sanitation'}]",1500.0,USD,2018-05-08T07:00:00Z,1500,"[{'due_date': '2018-06-08T07:00:00Z', 'amount': 125}, {'due_date': '2018-07-09T07:00:00Z', 'amount': 125}, {'due_date': '2018-08-08T07:00:00Z', 'amount': 125}, {'due_date': '2018-09-08T07:00:00Z', 'amount': 125}, {'due_date': '2018-10-08T07:00:00Z', 'amount': 125}, {'due_date': '2018-11-08T08:00:00Z', 'amount': 125}, {'due_date': '2018-12-08T08:00:00Z', 'amount': 125}, {'due_date': '2019-01-08T08:00:00Z', 'amount': 125}, {'due_date': '2019-02-08T08:00:00Z', 'amount': 125}, {'due_date': '2019-03-08T08:00:00Z', 'amount': 125}, {'due_date': '2019-04-08T07:00:00Z', 'amount': 125}, {'due_date': '2019-05-08T07:00:00Z', 'amount': 125}]",none,0.1,lender,Monthly,14,"[{'due_date': '2018-08-01T07:00:00Z', 'amount': 125}, {'due_date': '2018-09-01T07:00:00Z', 'amount': 125}, {'due_date': '2018-10-01T07:00:00Z', 'amount': 125}, {'due_date': '2018-11-01T07:00:00Z', 'amount': 125}, {'due_date': '2018-12-01T08:00:00Z', 'amount': 125}, {'due_date': '2019-01-01T08:00:00Z', 'amount': 125}, {'due_date': '2019-02-01T08:00:00Z', 'amount': 125}, {'due_date': '2019-03-01T08:00:00Z', 'amount': 125}, {'due_date': '2019-04-01T07:00:00Z', 'amount': 125}, {'due_date': '2019-05-01T07:00:00Z', 'amount': 125}, {'due_date': '2019-06-01T07:00:00Z', 'amount': 125}, {'due_date': '2019-07-01T07:00:00Z', 'amount': 125}]",,Katharina S,340594.0,to buy pharmaceutical products for resale.
7,Home Energy,,True,"[{'first_name': 'Peter Boro', 'last_name': '', 'gender': 'M', 'pictured': True}]",['en'],"Peter is a married man and together with his wife they are able to support their family. Peter does dairy farming for a living and he runs a retail shop, too, an activity which he has done for 12 years. <br /><br />He is in need of this loan to purchase a stove. With an energy efficient stove, he will be able to save on other expenses, thereby increasing his income. <br /><br />He has created employment for others through his dairy farming activities. He dreams of growing his retail business.",,,50,2018-05-27T02:27:43Z,1533683,2853788,1,0,0,2,50,Kenya,KE,town,-1.058634 36.777911,point,Githunguri,Peter Boro,386,[],2018-06-25T23:30:06Z,2018-05-26T23:30:06Z,Personal Use,funded,[],3990.0,KES,2018-05-09T07:00:00Z,50,[],shared,0.1,lender,,8,[],"['Solar', 'Clean Energy', 'Earth Day Campaign', 'Green']",,,to buy an energy efficient stove in order to save on expenses.
