,activity,basket_amount,bonus_credit_eligibility,borrowers,description.languages,description.texts.en,description.texts.fr,description.texts.pt,funded_amount,funded_date,id,image.id,image.template_id,journal_totals.bulkEntries,journal_totals.entries,lender_count,loan_amount,location.country,location.country_code,location.geo.level,location.geo.pairs,location.geo.type,location.town,name,partner_id,payments,planned_expiration_date,posted_date,sector,status,tags,terms.disbursal_amount,terms.disbursal_currency,terms.disbursal_date,terms.loan_amount,terms.local_payments,terms.loss_liability.currency_exchange,terms.loss_liability.currency_exchange_coverage_rate,terms.loss_liability.nonpayment,terms.repayment_interval,terms.repayment_term,terms.scheduled_payments,themes,translator.byline,translator.image,use
89,Farming,0.0,True,"[{'first_name': 'Violet', 'last_name': '', 'gender': 'F', 'pictured': True}]",['en'],"Violet is a rural smallholder farmer from the Kitale area of Kenya and is the mother of lovely children. Violet is married to a fellow farmer. Her family's main sources of income are horticulture and milk from their dairy farm. They are also involved in other agricultural activities such as growing bananas, vegetables, fruits and grains.<br /> <br />The biggest problem that farmers from her remote village face is the huge deficit in terms of access to agricultural inputs, meaning that the farmers' yields and incomes are far below what they could be. <br /><br />Juhudi Kilimo partnered with Kiva to provide financial services to smallholders around Kenya. Through these financial services, farmers from her remote village, like Violet, can now buy productive assets and important agricultural inputs for use on their farms. <br /><br />Violet is seeking a loan to buy farm inputs such as seeds and fertilizer to improve her horticulture farm. <br /><br />Your loan will enable her to improve her production. This intervention will help her fill the increasing demand for food in the market and, in the process, generate more income to repay the loan debt and improve the quality of life for her family. She also hopes to improve the condition of her house. <br /><br />Help this mother accomplish all her dreams with just one loan!",,,0,,1533593,2853673,1,0,0,0,300,Kenya,KE,town,1.016667 35,point,Kitale,Violet,156,[],2018-06-25T20:00:05Z,2018-05-26T20:00:05Z,Agriculture,fundraising,[],30000.0,KES,2018-05-15T07:00:00Z,300,"[{'due_date': '2018-06-15T07:00:00Z', 'amount': 2123.19}, {'due_date': '2018-07-15T07:00:00Z', 'amount': 2185.24}, {'due_date': '2018-08-15T07:00:00Z', 'amount': 2249.1}, {'due_date': '2018-09-15T07:00:00Z', 'amount': 2314.83}, {'due_date': '2018-10-15T07:00:00Z', 'amount': 2382.48}, {'due_date': '2018-11-15T08:00:00Z', 'amount': 2452.11}, {'due_date': '2018-12-15T08:00:00Z', 'amount': 2523.78}, {'due_date': '2019-01-15T08:00:00Z', 'amount': 2597.53}, {'due_date': '2019-02-15T08:00:00Z', 'amount': 2673.45}, {'due_date': '2019-03-15T07:00:00Z', 'amount': 2751.58}, {'due_date': '2019-04-15T07:00:00Z', 'amount': 2831.99}, {'due_date': '2019-05-15T07:00:00Z', 'amount': 2914.72}]",shared,0.1,lender,Monthly,14,"[{'due_date': '2018-08-01T07:00:00Z', 'amount': 21.23}, {'due_date': '2018-09-01T07:00:00Z', 'amount': 21.85}, {'due_date': '2018-10-01T07:00:00Z', 'amount': 22.49}, {'due_date': '2018-11-01T07:00:00Z', 'amount': 23.15}, {'due_date': '2018-12-01T08:00:00Z', 'amount': 23.82}, {'due_date': '2019-01-01T08:00:00Z', 'amount': 24.52}, {'due_date': '2019-02-01T08:00:00Z', 'amount': 25.24}, {'due_date': '2019-03-01T08:00:00Z', 'amount': 25.98}, {'due_date': '2019-04-01T07:00:00Z', 'amount': 26.73}, {'due_date': '2019-05-01T07:00:00Z', 'amount': 27.52}, {'due_date': '2019-06-01T07:00:00Z', 'amount': 28.32}, {'due_date': '2019-07-01T07:00:00Z', 'amount': 29.15}]",['Rural Exclusion'],,,to buy farm inputs such as seeds and fertilizer to improve her horticulture farm.
90,Farming,0.0,True,"[{'first_name': 'Ruth ', 'last_name': '', 'gender': 'F', 'pictured': True}]",['en'],"7uGreetings from Nkubu, Kenya! <br /><br />This is Ruth, a 32-year-old single mother who is a picture of beauty and has a captivating smile. Ruth is the true definition of a hard worker and a happy mother. She is a farmer in Nkubu, an area endowed with natural streams. Ruth grows maize, raises poultry, and engages in dairy farming. She produces milk and eggs for commercial purposes as opposed to many rural farmers who produce for subsistence. <br />         <br />Ruth also grows maize for food and sales. These commercial activities place her in a better position to engage in other agricultural businesses, which she does. Access to modern, quality farm inputs is the pillar of agricultural revolution. However, in Kenya, a developing country, fertilizers and seed allocation by the government is way below the needs of farmers. Since Juhudi Kilimo which is in partnership with Kiva, ventured in the affairs of smallholder farmers in Kenya, farmers can attest that there has been a significant improvement on inputs availability than were previously available. Ruth is seeking a loan to buy farm inputs such as certified seeds and nutrient-rich fertilizers. Your loan will enable her to improve her production through the use of quality farm inputs. Through this intervention, she will be able to improve the quality of her farm products and attract more buyers, leading to more profits.",,,0,,1533594,2853675,1,0,0,0,700,Kenya,KE,town,-0.064659 37.667929,point,Nkubu,Ruth,156,[],2018-06-25T20:00:05Z,2018-05-26T20:00:05Z,Agriculture,fundraising,[],70000.0,KES,2018-05-07T07:00:00Z,700,"[{'due_date': '2018-06-07T07:00:00Z', 'amount': 4954.1}, {'due_date': '2018-07-07T07:00:00Z', 'amount': 5098.88}, {'due_date': '2018-08-07T07:00:00Z', 'amount': 5247.9}, {'due_date': '2018-09-07T07:00:00Z', 'amount': 5401.27}, {'due_date': '2018-10-07T07:00:00Z', 'amount': 5559.12}, {'due_date': '2018-11-07T08:00:00Z', 'amount': 5721.59}, {'due_date': '2018-12-07T08:00:00Z', 'amount': 5888.8}, {'due_date': '2019-01-07T08:00:00Z', 'amount': 6060.9}, {'due_date': '2019-02-07T08:00:00Z', 'amount': 6238.03}, {'due_date': '2019-03-07T08:00:00Z', 'amount': 6420.34}, {'due_date': '2019-04-07T07:00:00Z', 'amount': 6607.97}, {'due_date': '2019-05-07T07:00:00Z', 'amount': 6801.1}]",shared,0.1,lender,Monthly,14,"[{'due_date': '2018-08-01T07:00:00Z', 'amount': 49.54}, {'due_date': '2018-09-01T07:00:00Z', 'amount': 50.99}, {'due_date': '2018-10-01T07:00:00Z', 'amount': 52.48}, {'due_date': '2018-11-01T07:00:00Z', 'amount': 54.01}, {'due_date': '2018-12-01T08:00:00Z', 'amount': 55.59}, {'due_date': '2019-01-01T08:00:00Z', 'amount': 57.22}, {'due_date': '2019-02-01T08:00:00Z', 'amount': 58.89}, {'due_date': '2019-03-01T08:00:00Z', 'amount': 60.61}, {'due_date': '2019-04-01T07:00:00Z', 'amount': 62.38}, {'due_date': '2019-05-01T07:00:00Z', 'amount': 64.2}, {'due_date': '2019-06-01T07:00:00Z', 'amount': 66.08}, {'due_date': '2019-07-01T07:00:00Z', 'amount': 68.01}]",['Rural Exclusion'],,,"to buy farm inputs such as certified seeds and nutrient-rich fertilizers and, as a hardworking single mother, to support her children."
91,Motorcycle Transport,0.0,False,"[{'first_name': 'Griffin ', 'last_name': '', 'gender': 'M', 'pictured': True}]",['en'],"Griffin is a married man. He has 2 children. He describes himself as God-fearing. He operates a transportation business where he transports customers from one point to another using his motorcycle. He also engages in dairy farming.<br /><br />He has been involved in this business for 6 years. His business is located in a good area and his primary customers are locals. He describes his biggest business challenge to be inadequate working capital.<br /><br />He will use the Kes 80,000 loan to purchase a cow and animal feed. This is his third loan with SMEP Microfinance Bank. Previous loans were repaid successfully.",,,0,,1533595,2852420,1,0,0,0,800,Kenya,KE,town,-0.683333 34.766667,point,Kisii,Griffin,138,[],2018-06-25T20:00:04Z,2018-05-26T20:00:05Z,Transportation,fundraising,"[{'name': 'user_favorite'}, {'name': '#Repeat Borrower'}]",80000.0,KES,2018-05-11T07:00:00Z,800,"[{'due_date': '2018-06-15T07:00:00Z', 'amount': 6666.67}, {'due_date': '2018-07-15T07:00:00Z', 'amount': 6666.67}, {'due_date': '2018-08-15T07:00:00Z', 'amount': 6666.67}, {'due_date': '2018-09-15T07:00:00Z', 'amount': 6666.67}, {'due_date': '2018-10-15T07:00:00Z', 'amount': 6666.67}, {'due_date': '2018-11-15T08:00:00Z', 'amount': 6666.67}, {'due_date': '2018-12-15T08:00:00Z', 'amount': 6666.67}, {'due_date': '2019-01-15T08:00:00Z', 'amount': 6666.67}, {'due_date': '2019-02-15T08:00:00Z', 'amount': 6666.67}, {'due_date': '2019-03-15T07:00:00Z', 'amount': 6666.67}, {'due_date': '2019-04-15T07:00:00Z', 'amount': 6666.67}, {'due_date': '2019-05-15T07:00:00Z', 'amount': 6666.63}]",shared,0.1,lender,Monthly,14,"[{'due_date': '2018-08-01T07:00:00Z', 'amount': 66.67}, {'due_date': '2018-09-01T07:00:00Z', 'amount': 66.67}, {'due_date': '2018-10-01T07:00:00Z', 'amount': 66.67}, {'due_date': '2018-11-01T07:00:00Z', 'amount': 66.67}, {'due_date': '2018-12-01T08:00:00Z', 'amount': 66.67}, {'due_date': '2019-01-01T08:00:00Z', 'amount': 66.67}, {'due_date': '2019-02-01T08:00:00Z', 'amount': 66.67}, {'due_date': '2019-03-01T08:00:00Z', 'amount': 66.67}, {'due_date': '2019-04-01T07:00:00Z', 'amount': 66.66}, {'due_date': '2019-05-01T07:00:00Z', 'amount': 66.66}, {'due_date': '2019-06-01T07:00:00Z', 'amount': 66.66}, {'due_date': '2019-07-01T07:00:00Z', 'amount': 66.66}]",['Rural Exclusion'],,,to purchase a cow and animal feeds.
92,Mobile Transactions,0.0,False,"[{'first_name': 'Rophence', 'last_name': '', 'gender': 'F', 'pictured': True}]",['en'],"Rophence is a Kiva borrower who describes herself as determined. She operates an Mpesa services shop where she offers money transfer services. She has been involved in this business for 2 years. <br /><br />Rophence's business is located in a good area and her primary customers are locals. She describes her biggest business challenge to be inadequate working capital.She will use the 80,000 KES loan to add more float of money to enable her carry out numerous transactions. <br /><br />Her business goal is to be a super agent in the future. She will use the anticipated profits to purchase additional stock of airtime and other items.",,,0,,1533590,2852403,1,0,0,0,800,Kenya,KE,town,-4.05 39.666667,point,Mombasa,Rophence,138,[],2018-06-25T20:00:04Z,2018-05-26T20:00:04Z,Services,fundraising,"[{'name': '#Woman Owned Biz'}, {'name': '#Repeat Borrower'}]",80000.0,KES,2018-05-15T07:00:00Z,800,"[{'due_date': '2018-06-15T07:00:00Z', 'amount': 6666.67}, {'due_date': '2018-07-15T07:00:00Z', 'amount': 6666.67}, {'due_date': '2018-08-15T07:00:00Z', 'amount': 6666.67}, {'due_date': '2018-09-15T07:00:00Z', 'amount': 6666.67}, {'due_date': '2018-10-15T07:00:00Z', 'amount': 6666.67}, {'due_date': '2018-11-15T08:00:00Z', 'amount': 6666.67}, {'due_date': '2018-12-15T08:00:00Z', 'amount': 6666.67}, {'due_date': '2019-01-15T08:00:00Z', 'amount': 6666.67}, {'due_date': '2019-02-15T08:00:00Z', 'amount': 6666.67}, {'due_date': '2019-03-15T07:00:00Z', 'amount': 6666.67}, {'due_date': '2019-04-15T07:00:00Z', 'amount': 6666.67}, {'due_date': '2019-05-11T07:00:00Z', 'amount': 6666.63}]",shared,0.1,lender,Monthly,14,"[{'due_date': '2018-08-01T07:00:00Z', 'amount': 66.67}, {'due_date': '2018-09-01T07:00:00Z', 'amount': 66.67}, {'due_date': '2018-10-01T07:00:00Z', 'amount': 66.67}, {'due_date': '2018-11-01T07:00:00Z', 'amount': 66.67}, {'due_date': '2018-12-01T08:00:00Z', 'amount': 66.67}, {'due_date': '2019-01-01T08:00:00Z', 'amount': 66.67}, {'due_date': '2019-02-01T08:00:00Z', 'amount': 66.67}, {'due_date': '2019-03-01T08:00:00Z', 'amount': 66.67}, {'due_date': '2019-04-01T07:00:00Z', 'amount': 66.66}, {'due_date': '2019-05-01T07:00:00Z', 'amount': 66.66}, {'due_date': '2019-06-01T07:00:00Z', 'amount': 66.66}, {'due_date': '2019-07-01T07:00:00Z', 'amount': 66.66}]",,Kyla Evans,2320957.0,to add more float of money to enable her carry out numerous transactions.
93,Farming,0.0,False,"[{'first_name': 'Martha', 'last_name': '', 'gender': 'F', 'pictured': True}]",['en'],"Martha is a married woman. She describes herself as determined. She operates a farm, where she grows potatoes, maize, beans, and other crops. She has been involved in this business for over three years. Her business is located in a fertile area, and her customers are primarily locals. She says her biggest business challenge is inadequate working capital. She will use the KES 60,000 loan to buy farm inputs, to boost production. She will use the anticipated profits to pay school fees.",,,0,,1533592,2382452,1,0,0,0,600,Kenya,KE,town,-0.248836 35.732371,point,Molo,Martha,138,[],2018-06-25T20:00:04Z,2018-05-26T20:00:04Z,Agriculture,fundraising,[{'name': '#Repeat Borrower'}],60000.0,KES,2018-05-15T07:00:00Z,600,"[{'due_date': '2018-06-15T07:00:00Z', 'amount': 5000}, {'due_date': '2018-07-15T07:00:00Z', 'amount': 5000}, {'due_date': '2018-08-15T07:00:00Z', 'amount': 5000}, {'due_date': '2018-09-15T07:00:00Z', 'amount': 5000}, {'due_date': '2018-10-15T07:00:00Z', 'amount': 5000}, {'due_date': '2018-11-15T08:00:00Z', 'amount': 5000}, {'due_date': '2018-12-15T08:00:00Z', 'amount': 5000}, {'due_date': '2019-01-15T08:00:00Z', 'amount': 5000}, {'due_date': '2019-02-15T08:00:00Z', 'amount': 5000}, {'due_date': '2019-03-15T07:00:00Z', 'amount': 5000}, {'due_date': '2019-04-15T07:00:00Z', 'amount': 5000}, {'due_date': '2019-05-15T07:00:00Z', 'amount': 5000}]",shared,0.1,lender,Monthly,14,"[{'due_date': '2018-08-01T07:00:00Z', 'amount': 50}, {'due_date': '2018-09-01T07:00:00Z', 'amount': 50}, {'due_date': '2018-10-01T07:00:00Z', 'amount': 50}, {'due_date': '2018-11-01T07:00:00Z', 'amount': 50}, {'due_date': '2018-12-01T08:00:00Z', 'amount': 50}, {'due_date': '2019-01-01T08:00:00Z', 'amount': 50}, {'due_date': '2019-02-01T08:00:00Z', 'amount': 50}, {'due_date': '2019-03-01T08:00:00Z', 'amount': 50}, {'due_date': '2019-04-01T07:00:00Z', 'amount': 50}, {'due_date': '2019-05-01T07:00:00Z', 'amount': 50}, {'due_date': '2019-06-01T07:00:00Z', 'amount': 50}, {'due_date': '2019-07-01T07:00:00Z', 'amount': 50}]",['Rural Exclusion'],,,to buy farm inputs to boost production.
94,Home Energy,0.0,True,"[{'first_name': 'Rose', 'last_name': '', 'gender': 'F', 'pictured': True}]",['en'],"Hello Kiva Community! <br /><br />Meet Rose, who is a crop and animal farmer, and a mother eager to provide the very best for her family. She states that with her small income, she hasn’t been able to provide sufficient lighting through the electricity in her home. Her family has been using kerosene lamps, despite the toxic fumes that put the family at risk of contracting respiratory diseases. <br /><br />Rose is kindly appealing for a loan to buy a solar lantern to provide adequate lighting, enabling her children to read well while at home. With the lantern’s dual charging capability, her husband will also be able to efficiently charge his phone. Kindly consider lending to her.",,,0,,1533580,2853660,1,0,0,0,100,Kenya,KE,town,1.016667 35,point,Kitale,Rose,156,[],2018-06-25T19:50:06Z,2018-05-26T19:50:06Z,Personal Use,fundraising,"[{'name': '#Eco-friendly'}, {'name': '#Parent'}, {'name': '#Health and Sanitation'}, {'name': '#Technology'}]",10000.0,KES,2018-04-27T07:00:00Z,100,"[{'due_date': '2018-04-27T07:00:00Z', 'amount': 707.73}, {'due_date': '2018-05-27T07:00:00Z', 'amount': 728.41}, {'due_date': '2018-06-27T07:00:00Z', 'amount': 749.7}, {'due_date': '2018-07-27T07:00:00Z', 'amount': 771.61}, {'due_date': '2018-08-27T07:00:00Z', 'amount': 794.16}, {'due_date': '2018-09-27T07:00:00Z', 'amount': 817.37}, {'due_date': '2018-10-27T07:00:00Z', 'amount': 841.26}, {'due_date': '2018-11-27T08:00:00Z', 'amount': 865.84}, {'due_date': '2018-12-27T08:00:00Z', 'amount': 891.15}, {'due_date': '2019-01-27T08:00:00Z', 'amount': 917.19}, {'due_date': '2019-02-27T08:00:00Z', 'amount': 944}, {'due_date': '2019-03-27T07:00:00Z', 'amount': 971.58}]",shared,0.1,lender,Monthly,13,"[{'due_date': '2018-07-01T07:00:00Z', 'amount': 7.08}, {'due_date': '2018-07-01T07:00:00Z', 'amount': 7.28}, {'due_date': '2018-08-01T07:00:00Z', 'amount': 7.5}, {'due_date': '2018-09-01T07:00:00Z', 'amount': 7.72}, {'due_date': '2018-10-01T07:00:00Z', 'amount': 7.94}, {'due_date': '2018-11-01T07:00:00Z', 'amount': 8.17}, {'due_date': '2018-12-01T08:00:00Z', 'amount': 8.41}, {'due_date': '2019-01-01T08:00:00Z', 'amount': 8.66}, {'due_date': '2019-02-01T08:00:00Z', 'amount': 8.91}, {'due_date': '2019-03-01T08:00:00Z', 'amount': 9.17}, {'due_date': '2019-04-01T07:00:00Z', 'amount': 9.44}, {'due_date': '2019-05-01T07:00:00Z', 'amount': 9.72}]","['Clean Energy', 'Green', 'Solar', 'Earth Day Campaign']",,,to buy a solar lantern.
95,Cereals,0.0,True,"[{'first_name': 'Adelaide', 'last_name': '', 'gender': 'F', 'pictured': True}]",['en'],"As a poor mother, Adelaide has been through many adversities, but she always triumphs. <br /><br />She is a smallholder farmer full of dreams and aspirations in her life. She resides in a remote village in the lush hills of Kitale, in the Rift Valley region of Kenya. <br /><br />As the key breadwinner of her family, Adelaide has been practicing mixed farming for the past nine years. Because of the immense knowledge she has of farming, she commands a lot of respect from other farmers in her village. <br /><br />Adelaide’s primary source of income has been milk, eggs, and crops. She also engages in a small business to supplement the meager income she earns through farming. <br /><br />Although she has been making profits from farming, she has identified a market segment for selling cereals. The only big challenge she faces is the lack of funds. <br /><br />Adelaide is requesting a loan to buy cereals. She intends to buy different varieties of cereals, such as lentils, cow peas, rice, and wheat, to sell in the local market. <br /><br />The market for cereals is never a problem because the demand is always high and she plans to take advantage of that. Because of the good relationship she has with her neighbors, she plans to increase her market by using word-of-mouth to reach more customers and markets. <br /><br />You can help this woman achieve her dreams with this loan, which will surely bring big profits. <br /><br />Light up a spirit this month!",,,0,,1533584,2853667,1,0,0,0,200,Kenya,KE,town,1.016667 35,point,Kitale,Adelaide,156,[],2018-06-25T19:50:06Z,2018-05-26T19:50:06Z,Food,fundraising,[{'name': '#Woman Owned Biz'}],20000.0,KES,2018-05-15T07:00:00Z,200,"[{'due_date': '2018-06-15T07:00:00Z', 'amount': 1415.46}, {'due_date': '2018-07-15T07:00:00Z', 'amount': 1456.83}, {'due_date': '2018-08-15T07:00:00Z', 'amount': 1499.4}, {'due_date': '2018-09-15T07:00:00Z', 'amount': 1543.22}, {'due_date': '2018-10-15T07:00:00Z', 'amount': 1588.32}, {'due_date': '2018-11-15T08:00:00Z', 'amount': 1634.74}, {'due_date': '2018-12-15T08:00:00Z', 'amount': 1682.52}, {'due_date': '2019-01-15T08:00:00Z', 'amount': 1731.69}, {'due_date': '2019-02-15T08:00:00Z', 'amount': 1782.3}, {'due_date': '2019-03-15T07:00:00Z', 'amount': 1834.38}, {'due_date': '2019-04-15T07:00:00Z', 'amount': 1887.99}, {'due_date': '2019-05-15T07:00:00Z', 'amount': 1943.15}]",shared,0.1,lender,Monthly,14,"[{'due_date': '2018-08-01T07:00:00Z', 'amount': 14.16}, {'due_date': '2018-09-01T07:00:00Z', 'amount': 14.57}, {'due_date': '2018-10-01T07:00:00Z', 'amount': 14.99}, {'due_date': '2018-11-01T07:00:00Z', 'amount': 15.43}, {'due_date': '2018-12-01T08:00:00Z', 'amount': 15.88}, {'due_date': '2019-01-01T08:00:00Z', 'amount': 16.35}, {'due_date': '2019-02-01T08:00:00Z', 'amount': 16.83}, {'due_date': '2019-03-01T08:00:00Z', 'amount': 17.32}, {'due_date': '2019-04-01T07:00:00Z', 'amount': 17.82}, {'due_date': '2019-05-01T07:00:00Z', 'amount': 18.34}, {'due_date': '2019-06-01T07:00:00Z', 'amount': 18.88}, {'due_date': '2019-07-01T07:00:00Z', 'amount': 19.43}]",['Rural Exclusion'],,,"to buy cereals (e.g., lentils, cow peas, and maize) to sell, so this hard-working mother can improve her income and be better able to support her family."
96,Clothing Sales,,True,"[{'first_name': 'John', 'last_name': '', 'gender': 'M', 'pictured': True}, {'first_name': 'George', 'last_name': '', 'gender': 'M', 'pictured': True}, {'first_name': 'Ramatu', 'last_name': '', 'gender': 'F', 'pictured': True}, {'first_name': 'Alberta', 'last_name': '', 'gender': 'F', 'pictured': True}]",['en'],"John is 36 years old and lives in Chorkor. He has lived in Chorkor for some years now. Originally, he is from Accra. John has three children who are all schooling. He is applying for a loan portion to buy more bags to sell. <br /><br />His dream for the future is to expand his business to buy and sell cloths and bags wholesale.<br /><br />He and his counterpart would like to thank all of his Kiva lenders for their generosity and support.",,,900,2018-05-26T23:02:39Z,1533585,2853649,1,0,0,18,900,Ghana,GH,town,5.528871 -0.24675,point,Chorkor,Biakoye Group,231,[],2018-06-25T19:50:06Z,2018-05-26T19:50:06Z,Clothing,funded,[],4100.0,GHS,2018-05-04T07:00:00Z,900,[],shared,0.1,lender,,7,[],,John Hope,1566276.0,to buy and sell clothes and bags wholesale.
97,Farming,0.0,True,"[{'first_name': 'Auwulu', 'last_name': '', 'gender': 'M', 'pictured': True}]",['en'],"Auwulu is from a small community in Kaduna state where he grows maize to support his family. Auwulu has been a Babban Gona member for one season and, as a result, he has been able to send two children to a better school with the profits from his farm.<br /><br />Auwulu’s goal for this farming season is to learn new agronomic practices. With this loan, he will get access to improved seeds, fertilizers, herbicides and other inputs that are critical to increasing his yield to up to 4.2 metric tonnes per hectare, which is more than double the national average in Nigeria. This will enable him generate earnings of up to four times the average Nigerian farmer’s annual income.<br /><br />Auwulu recalls sending his children to school as his happiest memory as a Babban Gona member. Auwulu looks forward to a brighter future with Babban Gona and to making many more great memories with his family.",,,50,,1533591,2853672,1,0,0,2,175,Nigeria,NG,town,10.510464 7.416505,point,Kaduna,Auwulu,288,[],2018-06-25T19:50:06Z,2018-05-26T19:50:06Z,Agriculture,fundraising,[{'name': '#Vegan'}],56990.5,NGN,2018-07-15T07:00:00Z,175,"[{'due_date': '2019-12-31T08:00:00Z', 'amount': 56990.5}]",shared,0.1,lender,At end of term,19,"[{'due_date': '2020-02-01T08:00:00Z', 'amount': 175}]","['Underfunded Areas', 'Rural Exclusion', 'Vulnerable Groups', 'Innovative Loans']",,,to purchase improved inputs to get a good yield and enhance living standards.
98,Personal Care Products,,False,"[{'first_name': 'Rosemary', 'last_name': '', 'gender': 'F', 'pictured': True}]",['en'],"Rosemary is 43 years old, married and blessed with five children.  She makes and sells liquid detergents as well as practices farming, which she has done for 11 years. <br /><br />This is Rosemary's second loan, which she will use to buy ingredients to make liquid washing detergents. She will use the profits from the expanded business to educate and provide basic needs like food, clothing, medical care and education for her children, as well as service the loan.<br /><br />Rosemary's hopes and dreams are to build a strong business, improve her family’s standard of living and provide her children with the best education.",,,200,2018-05-27T01:54:40Z,1533588,2852573,1,0,0,8,200,Kenya,KE,town,-1.305567 37.345322,point,Tala;Kangundo,Rosemary,133,[],2018-06-25T19:50:05Z,2018-05-26T19:50:05Z,Manufacturing,funded,[{'name': '#Repeat Borrower'}],20000.0,KES,2018-05-08T07:00:00Z,200,[],shared,0.1,lender,,14,[],,,,to buy ingredients to make liquid washing detergents.
