,activity,basket_amount,bonus_credit_eligibility,borrowers,description.languages,description.texts.en,description.texts.fr,description.texts.pt,funded_amount,funded_date,id,image.id,image.template_id,journal_totals.bulkEntries,journal_totals.entries,lender_count,loan_amount,location.country,location.country_code,location.geo.level,location.geo.pairs,location.geo.type,location.town,name,partner_id,payments,planned_expiration_date,posted_date,sector,status,tags,terms.disbursal_amount,terms.disbursal_currency,terms.disbursal_date,terms.loan_amount,terms.local_payments,terms.loss_liability.currency_exchange,terms.loss_liability.currency_exchange_coverage_rate,terms.loss_liability.nonpayment,terms.repayment_interval,terms.repayment_term,terms.scheduled_payments,themes,translator.byline,translator.image,use
147,Farming,,True,"[{'first_name': 'Suleiman', 'last_name': '', 'gender': 'M', 'pictured': True}]",['en'],"Suleiman is from a small community in Kaduna state where he grows maize to support his family. Suleiman has been a Babban Gona member for two seasons and as a result, he has been able to send three children to a better school with the profits from his farm.<br /><br />Suleiman’s goal for this farming season is to double last year's yield. With this loan, he will get access to improved seed, fertilizers, herbicides and other inputs which are critical to increasing his yield to up to 4.2 metric tonnes per hectare, which is more than double the national average in Nigeria. This will enable him generate earnings of up to four times the average Nigerian farmer’s annual income<br /><br />Suleiman recalls buying more farmland as his happiest memory as a Babban Gona member. Suleiman looks forward to a brighter future with Babban Gona and to making many more great memories with his family.",,,75,2018-05-26T13:27:59Z,1533458,2853492,1,0,0,3,75,Nigeria,NG,town,10.510464 7.416505,point,Kaduna,Suleiman,288,[],2018-06-25T10:50:04Z,2018-05-26T10:50:04Z,Agriculture,funded,[{'name': '#Vegan'}],22796.2,NGN,2018-07-15T07:00:00Z,75,[],shared,0.1,lender,,19,[],"['Underfunded Areas', 'Rural Exclusion', 'Vulnerable Groups', 'Innovative Loans']",Tim Gibson,2786691.0,to buy fertilizers and seed in order to get a good harvest and earn more money.
148,Clothing Sales,0.0,False,"[{'first_name': 'Memory ', 'last_name': '', 'gender': 'F', 'pictured': True}]",['en'],"Memory is a 36 year old woman who buys and sells clothes. She travels to neighboring countries like South Africa and Zambia once or twice every month to buy trending clothes. For five years now she has been in this business and over time her business has recorded significant growth and she managed to open a small flea market in Harare’s Central business District. She is managing her business very well and has been casually employing someone to assist her when she is out of the country.<br /><br />Memory is married and her husband is self-employed. She is staying in the suburb of Kuwadzana Harare. They have 2 children, both going to school. She depends upon income from her business and assistance from her husband in taking care of their children. Memory is a hardworking woman and is driven by the passion to take good care of her children.<br /><br />Memory came to Thrive Microfinance in March this year and is applying for an individual loan of $800. She needs this loan so that she can boost up stocks for her flea market. She has plans to open another flea market soon. She plans to purchase winter stocks in bulk. She also runs a phone accessories which she wants to boost by increasing the size of her orders.",,,125,,1533457,2851845,1,0,0,5,800,Zimbabwe,ZW,town,-17.825166 31.03351,point,Harare,Memory,367,[],2018-06-25T10:40:03Z,2018-05-26T10:40:03Z,Clothing,fundraising,[],800.0,USD,2018-04-24T07:00:00Z,800,"[{'due_date': '2018-05-24T07:00:00Z', 'amount': 133.33}, {'due_date': '2018-06-24T07:00:00Z', 'amount': 133.33}, {'due_date': '2018-07-24T07:00:00Z', 'amount': 133.33}, {'due_date': '2018-08-24T07:00:00Z', 'amount': 133.33}, {'due_date': '2018-09-24T07:00:00Z', 'amount': 133.33}, {'due_date': '2018-10-24T07:00:00Z', 'amount': 133.35}]",none,0.1,lender,Monthly,8,"[{'due_date': '2018-07-01T07:00:00Z', 'amount': 133.33}, {'due_date': '2018-08-01T07:00:00Z', 'amount': 133.33}, {'due_date': '2018-09-01T07:00:00Z', 'amount': 133.33}, {'due_date': '2018-10-01T07:00:00Z', 'amount': 133.33}, {'due_date': '2018-11-01T07:00:00Z', 'amount': 133.33}, {'due_date': '2018-12-01T08:00:00Z', 'amount': 133.35}]",['Youth'],Tim Gibson,2786691.0,boost stocks for her clothing sales business.
149,Farming,0.0,True,"[{'first_name': 'Living', 'last_name': '', 'gender': 'M', 'pictured': True}]",['en'],"Living is a repeat client of UGAFODE Microfinance Ltd (MDI). He has been a good client who has always paid his installments on time. He is 38 years old, married with six children who attend school. <br /><br />Living's main source of income is agriculture, majoring in pineapple and banana growing done on a large scale. His main clients are the food markets in Ishaka and Mbarara. With the money he gets from this business, he educates his children and also supports some dependants.<br /><br />Living is challenged with the transportation of his farm produce to the market. It is costly and most of the time it is unreliable. He has applied for a loan of 3,500,000 UGX from UGAFODE to buy a motorcycle, which he will use to transport his produce to the food markets. Living is hopeful that this will reduce his operational costs, thus increasing his profits. It will also enable him to make timely deliveries to his clients.<br /><br />Living sends his gratitude to the funders for the financial empowerment. Living and his wife appear in the photograph in their plantation.",,,0,,1533456,2853489,1,0,0,0,950,Uganda,UG,town,-0.543056 30.136944,point,Ishaka,Living,222,[],2018-06-25T09:20:03Z,2018-05-26T09:20:03Z,Agriculture,fundraising,[{'name': 'user_favorite'}],3500000.0,UGX,2018-05-15T07:00:00Z,950,"[{'due_date': '2018-06-15T07:00:00Z', 'amount': 174555.87}, {'due_date': '2018-07-16T07:00:00Z', 'amount': 181570.11}, {'due_date': '2018-08-15T07:00:00Z', 'amount': 188866.2}, {'due_date': '2018-09-15T07:00:00Z', 'amount': 196455.47}, {'due_date': '2018-10-15T07:00:00Z', 'amount': 204349.71}, {'due_date': '2018-11-15T08:00:00Z', 'amount': 212561.16}, {'due_date': '2018-12-15T08:00:00Z', 'amount': 221102.57}, {'due_date': '2019-01-15T08:00:00Z', 'amount': 229987.21}, {'due_date': '2019-02-15T08:00:00Z', 'amount': 239228.86}, {'due_date': '2019-03-15T07:00:00Z', 'amount': 248841.87}, {'due_date': '2019-04-15T07:00:00Z', 'amount': 258841.16}, {'due_date': '2019-05-15T07:00:00Z', 'amount': 269242.26}, {'due_date': '2019-06-15T07:00:00Z', 'amount': 280061.31}, {'due_date': '2019-07-15T07:00:00Z', 'amount': 291315.11}, {'due_date': '2019-08-15T07:00:00Z', 'amount': 303021.13}]",shared,0.1,lender,Monthly,17,"[{'due_date': '2018-08-01T07:00:00Z', 'amount': 47.38}, {'due_date': '2018-09-01T07:00:00Z', 'amount': 49.28}, {'due_date': '2018-10-01T07:00:00Z', 'amount': 51.26}, {'due_date': '2018-11-01T07:00:00Z', 'amount': 53.32}, {'due_date': '2018-12-01T08:00:00Z', 'amount': 55.47}, {'due_date': '2019-01-01T08:00:00Z', 'amount': 57.7}, {'due_date': '2019-02-01T08:00:00Z', 'amount': 60.01}, {'due_date': '2019-03-01T08:00:00Z', 'amount': 62.43}, {'due_date': '2019-04-01T07:00:00Z', 'amount': 64.93}, {'due_date': '2019-05-01T07:00:00Z', 'amount': 67.54}, {'due_date': '2019-06-01T07:00:00Z', 'amount': 70.26}, {'due_date': '2019-07-01T07:00:00Z', 'amount': 73.08}, {'due_date': '2019-08-01T07:00:00Z', 'amount': 76.02}, {'due_date': '2019-09-01T07:00:00Z', 'amount': 79.07}, {'due_date': '2019-10-01T07:00:00Z', 'amount': 82.25}]",['Rural Exclusion'],,,to buy a motorcycle that will transport his produce to the market.
150,Beauty Salon,,False,"[{'first_name': 'Rehema', 'last_name': '', 'gender': 'F', 'pictured': True}, {'first_name': 'Mossi', 'last_name': '', 'gender': 'F', 'pictured': True}, {'first_name': 'Christina', 'last_name': '', 'gender': 'F', 'pictured': True}, {'first_name': 'Tatu', 'last_name': '', 'gender': 'F', 'pictured': True}, {'first_name': 'Zuhura', 'last_name': '', 'gender': 'F', 'pictured': True}, {'first_name': 'Salima', 'last_name': '', 'gender': 'F', 'pictured': True}, {'first_name': 'Khadija', 'last_name': '', 'gender': 'F', 'pictured': True}, {'first_name': 'Zuhura', 'last_name': '', 'gender': 'F', 'pictured': True}]",['en'],"Rehema is a 34-year-old divorced mother of 4 school-going children. She is a hair dressing salon owner, and has been into this business for 3 years. She opens her salon at 8 a.m. and closes at 9 p.m. She earns profit.<br /><br />This will be Rehema's first loan request from Tujijenge Tanzania. She is applying for this loan to buy a set of combs, hand dryer, hair steamer, shampoo bowl, and furniture. <br /><br />Rehema's dream is to become a best make up artist. She will share this loan with her loan group members of Lisbon 2 Group.",,,1250,2018-05-26T14:46:27Z,1533455,2853490,1,0,0,27,1250,Tanzania,TZ,town,-6.8 39.283333,point,Dar es Salaam,Lisbon 2 Group,87,[],2018-06-25T09:20:02Z,2018-05-26T09:20:02Z,Services,funded,"[{'name': 'user_favorite'}, {'name': '#First Loan'}, {'name': '#Woman Owned Biz'}, {'name': '#Parent'}, {'name': '#Repair Renew Replace'}]",2800000.0,TZS,2018-05-18T07:00:00Z,1250,[],shared,0.1,lender,,8,[],,,,"to buy a set of combs, hand dryer, hair steamer, shampoo bowl, and furniture."
151,Farming,25.0,True,"[{'first_name': 'Suleiman', 'last_name': '', 'gender': 'M', 'pictured': True}]",['en'],"Suleiman is from a small community in Kaduna state where he grows maize to support his family. Suleiman has been a Babban Gona member for two seasons and as a result, he has been able to send one child to a better school with the profits from his farm.<br /><br />Suleiman’s goal for this farming season is to be the best performing farmer in his community. With this loan, he will get access to improved seeds, fertilizers, herbicides and other inputs which are critical to increasing his yield up to 4.2 metric tonnes per hectare, which is more than double the national average in Nigeria. This will enable him to generate earnings of up to four times the average Nigerian farmer’s annual income<br /><br />Suleiman recalls feeding his family all the time as his happiest memory as a Babban Gona member. Suleiman looks forward to a brighter future with Babban Gona and to making many more great memories with his family.",,,75,,1533450,2853483,1,0,0,3,150,Nigeria,NG,town,10.510464 7.416505,point,Kaduna,Suleiman,288,[],2018-06-25T08:20:04Z,2018-05-26T08:20:05Z,Agriculture,fundraising,[{'name': '#Vegan'}],45592.4,NGN,2018-07-15T07:00:00Z,150,"[{'due_date': '2019-12-31T08:00:00Z', 'amount': 45592.4}]",shared,0.1,lender,At end of term,19,"[{'due_date': '2020-02-01T08:00:00Z', 'amount': 150}]","['Underfunded Areas', 'Rural Exclusion', 'Vulnerable Groups', 'Innovative Loans']",,,to purchase improved inputs in order to get a good harvest and earn more money.
152,Fish Selling,,True,"[{'first_name': 'Esther', 'last_name': '', 'gender': 'F', 'pictured': True}]",['en'],"Esther is 18 years old and lives in the town of Namutumba in the Iganga region of Uganda. For the past 2 years, Esther has been working hard to manage her fish business, which sells smoked, dried and fried fish. <br /><br />To help expand her business, Esther has requested a loan of 600,000 Ugandan Shillings from BRAC Uganda. The loan will be used to stock more fish for the business, and will help Esther to generate greater profits. From the higher profits, Esther will also provide basic needs like food at home, cater for her siblings, contribute to the respective school dues and thereby having better standards of living. Esther hopes that in the future she will be able to establish a retail business to increase on her revenue.<br /><br />Esther is a member of BRAC's Empowerment and Livelihood for Adolescents (ELA) program. In addition to microfinance loans, the program provides both a safe place for young Ugandan women to take part in group activities, and a forum for life-skills training.",,,175,2018-05-26T13:00:31Z,1533447,2853462,1,0,0,5,175,Uganda,UG,town,0.83609 33.686097,point,Namutumba,Esther,65,[],2018-06-25T08:20:02Z,2018-05-26T08:20:02Z,Food,funded,[{'name': 'user_favorite'}],600000.0,UGX,2018-05-09T07:00:00Z,175,[],shared,0.1,lender,,11,[],"['Vulnerable Groups', 'Youth']",,,to stock more fish for her business.
153,Restaurant,0.0,True,"[{'first_name': 'Hadijja', 'last_name': '', 'gender': 'F', 'pictured': True}]",['en'],"Hadijja is 20 years old and lives in the town of Kaliro in the Iganga region of Uganda. For the past three years, Hadijja has been working hard to manage her restaurant where she  sells cooked rice, beans, maize flour and green bananas. <br /><br />To help expand her business, Hadijja has requested a loan of 900,000 Ugandan Shillings from BRAC Uganda. The loan will be used to buy bigger sauce pans, more rice, beans and maize flour, and will help Hadijja to generate greater profits. The business will expand and hence more profits. Hadijja will afford more basic needs and clothing and support her siblings, thereby improving her standard of living. <br /><br />Hadijja hopes that in the future she will be able to expand the restaurant to a hotel. <br /><br />Hadijja is a member of BRAC's Empowerment and Livelihood for Adolescents (ELA) program. In addition to microfinance loans, the program provides both a safe place for young Ugandan women to take part in group activities, and a forum for life-skills training.",,,50,,1533449,2853478,1,0,0,2,250,Uganda,UG,town,1.043111 33.483191,point,Kaliro,Hadijja,65,[],2018-06-25T08:20:02Z,2018-05-26T08:20:02Z,Food,fundraising,[{'name': 'user_favorite'}],900000.0,UGX,2018-05-07T07:00:00Z,250,"[{'due_date': '2018-05-21T07:00:00Z', 'amount': 17923}, {'due_date': '2018-05-28T07:00:00Z', 'amount': 18126}, {'due_date': '2018-06-04T07:00:00Z', 'amount': 18332}, {'due_date': '2018-06-11T07:00:00Z', 'amount': 18540}, {'due_date': '2018-06-18T07:00:00Z', 'amount': 18750}, {'due_date': '2018-06-25T07:00:00Z', 'amount': 18963}, {'due_date': '2018-07-02T07:00:00Z', 'amount': 19178}, {'due_date': '2018-07-09T07:00:00Z', 'amount': 19396}, {'due_date': '2018-07-16T07:00:00Z', 'amount': 19616}, {'due_date': '2018-07-23T07:00:00Z', 'amount': 19839}, {'due_date': '2018-07-30T07:00:00Z', 'amount': 20064}, {'due_date': '2018-08-06T07:00:00Z', 'amount': 20292}, {'due_date': '2018-08-13T07:00:00Z', 'amount': 20522}, {'due_date': '2018-08-20T07:00:00Z', 'amount': 20755}, {'due_date': '2018-08-27T07:00:00Z', 'amount': 20990}, {'due_date': '2018-09-03T07:00:00Z', 'amount': 21229}, {'due_date': '2018-09-10T07:00:00Z', 'amount': 21470}, {'due_date': '2018-09-17T07:00:00Z', 'amount': 21713}, {'due_date': '2018-09-24T07:00:00Z', 'amount': 21960}, {'due_date': '2018-10-01T07:00:00Z', 'amount': 22209}, {'due_date': '2018-10-08T07:00:00Z', 'amount': 22461}, {'due_date': '2018-10-15T07:00:00Z', 'amount': 22716}, {'due_date': '2018-10-22T07:00:00Z', 'amount': 22974}, {'due_date': '2018-10-29T07:00:00Z', 'amount': 23235}, {'due_date': '2018-11-05T08:00:00Z', 'amount': 23498}, {'due_date': '2018-11-12T08:00:00Z', 'amount': 23765}, {'due_date': '2018-11-19T08:00:00Z', 'amount': 24035}, {'due_date': '2018-11-26T08:00:00Z', 'amount': 24308}, {'due_date': '2018-12-03T08:00:00Z', 'amount': 24584}, {'due_date': '2018-12-10T08:00:00Z', 'amount': 24863}, {'due_date': '2018-12-17T08:00:00Z', 'amount': 25145}, {'due_date': '2018-12-24T08:00:00Z', 'amount': 25430}, {'due_date': '2018-12-31T08:00:00Z', 'amount': 25719}, {'due_date': '2019-01-07T08:00:00Z', 'amount': 26011}, {'due_date': '2019-01-14T08:00:00Z', 'amount': 26306}, {'due_date': '2019-01-21T08:00:00Z', 'amount': 26605}, {'due_date': '2019-01-28T08:00:00Z', 'amount': 26907}, {'due_date': '2019-02-04T08:00:00Z', 'amount': 27213}, {'due_date': '2019-02-11T08:00:00Z', 'amount': 27522}, {'due_date': '2019-02-18T08:00:00Z', 'amount': 26836}]",shared,0.1,lender,Monthly,14,"[{'due_date': '2018-07-01T07:00:00Z', 'amount': 4.98}, {'due_date': '2018-07-01T07:00:00Z', 'amount': 5.04}, {'due_date': '2018-08-01T07:00:00Z', 'amount': 5.09}, {'due_date': '2018-08-01T07:00:00Z', 'amount': 5.15}, {'due_date': '2018-08-01T07:00:00Z', 'amount': 5.21}, {'due_date': '2018-08-01T07:00:00Z', 'amount': 5.27}, {'due_date': '2018-09-01T07:00:00Z', 'amount': 5.33}, {'due_date': '2018-09-01T07:00:00Z', 'amount': 5.39}, {'due_date': '2018-09-01T07:00:00Z', 'amount': 5.45}, {'due_date': '2018-09-01T07:00:00Z', 'amount': 5.51}, {'due_date': '2018-09-01T07:00:00Z', 'amount': 5.57}, {'due_date': '2018-10-01T07:00:00Z', 'amount': 5.64}, {'due_date': '2018-10-01T07:00:00Z', 'amount': 5.7}, {'due_date': '2018-10-01T07:00:00Z', 'amount': 5.77}, {'due_date': '2018-10-01T07:00:00Z', 'amount': 5.83}, {'due_date': '2018-11-01T07:00:00Z', 'amount': 5.9}, {'due_date': '2018-11-01T07:00:00Z', 'amount': 5.96}, {'due_date': '2018-11-01T07:00:00Z', 'amount': 6.03}, {'due_date': '2018-11-01T07:00:00Z', 'amount': 6.1}, {'due_date': '2018-12-01T08:00:00Z', 'amount': 6.17}, {'due_date': '2018-12-01T08:00:00Z', 'amount': 6.24}, {'due_date': '2018-12-01T08:00:00Z', 'amount': 6.31}, {'due_date': '2018-12-01T08:00:00Z', 'amount': 6.38}, {'due_date': '2018-12-01T08:00:00Z', 'amount': 6.45}, {'due_date': '2019-01-01T08:00:00Z', 'amount': 6.53}, {'due_date': '2019-01-01T08:00:00Z', 'amount': 6.6}, {'due_date': '2019-01-01T08:00:00Z', 'amount': 6.68}, {'due_date': '2019-01-01T08:00:00Z', 'amount': 6.75}, {'due_date': '2019-02-01T08:00:00Z', 'amount': 6.83}, {'due_date': '2019-02-01T08:00:00Z', 'amount': 6.91}, {'due_date': '2019-02-01T08:00:00Z', 'amount': 6.98}, {'due_date': '2019-02-01T08:00:00Z', 'amount': 7.06}, {'due_date': '2019-02-01T08:00:00Z', 'amount': 7.14}, {'due_date': '2019-03-01T08:00:00Z', 'amount': 7.23}, {'due_date': '2019-03-01T08:00:00Z', 'amount': 7.31}, {'due_date': '2019-03-01T08:00:00Z', 'amount': 7.39}, {'due_date': '2019-03-01T08:00:00Z', 'amount': 7.47}, {'due_date': '2019-04-01T07:00:00Z', 'amount': 7.56}, {'due_date': '2019-04-01T07:00:00Z', 'amount': 7.64}, {'due_date': '2019-04-01T07:00:00Z', 'amount': 7.45}]","['Vulnerable Groups', 'Youth']",,,"to buy bigger sauce pans, more rice, beans and maize flour."
154,Fruits & Vegetables,0.0,True,"[{'first_name': 'John Kimiti', 'last_name': '', 'gender': 'M', 'pictured': True}]",['en'],"John is happily married and, together with his wife, has been blessed with a child. He runs a grocery business in which he enjoys serving his clients. He intends to add more stock to meet growing demand. This is his second loan, which he will be able to pay back from the profits generated. He dreams of becoming a more successful business man in future.",,,0,,1533439,2853479,1,0,0,0,350,Kenya,KE,town,-0.437099 36.95801,point,nyeri,John Kimiti,386,[],2018-06-25T08:10:04Z,2018-05-26T08:10:04Z,Food,fundraising,[],35000.0,KES,2018-05-14T07:00:00Z,350,"[{'due_date': '2018-06-21T07:00:00Z', 'amount': 729.58}, {'due_date': '2018-06-28T07:00:00Z', 'amount': 729.58}, {'due_date': '2018-07-05T07:00:00Z', 'amount': 729.58}, {'due_date': '2018-07-12T07:00:00Z', 'amount': 729.58}, {'due_date': '2018-07-19T07:00:00Z', 'amount': 729.58}, {'due_date': '2018-07-26T07:00:00Z', 'amount': 729.58}, {'due_date': '2018-08-02T07:00:00Z', 'amount': 729.58}, {'due_date': '2018-08-09T07:00:00Z', 'amount': 729.58}, {'due_date': '2018-08-16T07:00:00Z', 'amount': 729.58}, {'due_date': '2018-08-23T07:00:00Z', 'amount': 729.58}, {'due_date': '2018-08-30T07:00:00Z', 'amount': 729.58}, {'due_date': '2018-09-06T07:00:00Z', 'amount': 729.58}, {'due_date': '2018-09-13T07:00:00Z', 'amount': 729.58}, {'due_date': '2018-09-20T07:00:00Z', 'amount': 729.58}, {'due_date': '2018-09-27T07:00:00Z', 'amount': 729.58}, {'due_date': '2018-10-04T07:00:00Z', 'amount': 729.58}, {'due_date': '2018-10-11T07:00:00Z', 'amount': 729.58}, {'due_date': '2018-10-18T07:00:00Z', 'amount': 729.58}, {'due_date': '2018-10-25T07:00:00Z', 'amount': 729.58}, {'due_date': '2018-11-01T07:00:00Z', 'amount': 729.58}, {'due_date': '2018-11-08T08:00:00Z', 'amount': 729.58}, {'due_date': '2018-11-15T08:00:00Z', 'amount': 729.58}, {'due_date': '2018-11-22T08:00:00Z', 'amount': 729.58}, {'due_date': '2018-11-29T08:00:00Z', 'amount': 729.58}, {'due_date': '2018-12-06T08:00:00Z', 'amount': 729.58}, {'due_date': '2018-12-13T08:00:00Z', 'amount': 729.58}, {'due_date': '2018-12-20T08:00:00Z', 'amount': 729.58}, {'due_date': '2018-12-27T08:00:00Z', 'amount': 729.58}, {'due_date': '2019-01-03T08:00:00Z', 'amount': 729.58}, {'due_date': '2019-01-10T08:00:00Z', 'amount': 729.58}, {'due_date': '2019-01-17T08:00:00Z', 'amount': 729.58}, {'due_date': '2019-01-24T08:00:00Z', 'amount': 729.58}, {'due_date': '2019-01-31T08:00:00Z', 'amount': 729.58}, {'due_date': '2019-02-07T08:00:00Z', 'amount': 729.58}, {'due_date': '2019-02-14T08:00:00Z', 'amount': 729.58}, {'due_date': '2019-02-21T08:00:00Z', 'amount': 729.58}, {'due_date': '2019-02-28T08:00:00Z', 'amount': 729.58}, {'due_date': '2019-03-07T08:00:00Z', 'amount': 729.58}, {'due_date': '2019-03-14T07:00:00Z', 'amount': 729.58}, {'due_date': '2019-03-21T07:00:00Z', 'amount': 729.58}, {'due_date': '2019-03-28T07:00:00Z', 'amount': 729.58}, {'due_date': '2019-04-04T07:00:00Z', 'amount': 729.58}, {'due_date': '2019-04-11T07:00:00Z', 'amount': 729.58}, {'due_date': '2019-04-18T07:00:00Z', 'amount': 729.58}, {'due_date': '2019-04-25T07:00:00Z', 'amount': 729.58}, {'due_date': '2019-05-02T07:00:00Z', 'amount': 729.58}, {'due_date': '2019-05-09T07:00:00Z', 'amount': 729.58}, {'due_date': '2019-05-16T07:00:00Z', 'amount': 709.74}]",shared,0.1,lender,Monthly,14,"[{'due_date': '2018-08-01T07:00:00Z', 'amount': 7.3}, {'due_date': '2018-08-01T07:00:00Z', 'amount': 7.3}, {'due_date': '2018-09-01T07:00:00Z', 'amount': 7.3}, {'due_date': '2018-09-01T07:00:00Z', 'amount': 7.3}, {'due_date': '2018-09-01T07:00:00Z', 'amount': 7.3}, {'due_date': '2018-09-01T07:00:00Z', 'amount': 7.3}, {'due_date': '2018-10-01T07:00:00Z', 'amount': 7.3}, {'due_date': '2018-10-01T07:00:00Z', 'amount': 7.3}, {'due_date': '2018-10-01T07:00:00Z', 'amount': 7.3}, {'due_date': '2018-10-01T07:00:00Z', 'amount': 7.3}, {'due_date': '2018-10-01T07:00:00Z', 'amount': 7.3}, {'due_date': '2018-11-01T07:00:00Z', 'amount': 7.3}, {'due_date': '2018-11-01T07:00:00Z', 'amount': 7.3}, {'due_date': '2018-11-01T07:00:00Z', 'amount': 7.3}, {'due_date': '2018-11-01T07:00:00Z', 'amount': 7.3}, {'due_date': '2018-12-01T08:00:00Z', 'amount': 7.3}, {'due_date': '2018-12-01T08:00:00Z', 'amount': 7.3}, {'due_date': '2018-12-01T08:00:00Z', 'amount': 7.3}, {'due_date': '2018-12-01T08:00:00Z', 'amount': 7.3}, {'due_date': '2019-01-01T08:00:00Z', 'amount': 7.3}, {'due_date': '2019-01-01T08:00:00Z', 'amount': 7.3}, {'due_date': '2019-01-01T08:00:00Z', 'amount': 7.3}, {'due_date': '2019-01-01T08:00:00Z', 'amount': 7.3}, {'due_date': '2019-01-01T08:00:00Z', 'amount': 7.3}, {'due_date': '2019-02-01T08:00:00Z', 'amount': 7.3}, {'due_date': '2019-02-01T08:00:00Z', 'amount': 7.3}, {'due_date': '2019-02-01T08:00:00Z', 'amount': 7.3}, {'due_date': '2019-02-01T08:00:00Z', 'amount': 7.29}, {'due_date': '2019-03-01T08:00:00Z', 'amount': 7.29}, {'due_date': '2019-03-01T08:00:00Z', 'amount': 7.29}, {'due_date': '2019-03-01T08:00:00Z', 'amount': 7.29}, {'due_date': '2019-03-01T08:00:00Z', 'amount': 7.29}, {'due_date': '2019-03-01T08:00:00Z', 'amount': 7.29}, {'due_date': '2019-04-01T07:00:00Z', 'amount': 7.29}, {'due_date': '2019-04-01T07:00:00Z', 'amount': 7.29}, {'due_date': '2019-04-01T07:00:00Z', 'amount': 7.29}, {'due_date': '2019-04-01T07:00:00Z', 'amount': 7.29}, {'due_date': '2019-05-01T07:00:00Z', 'amount': 7.29}, {'due_date': '2019-05-01T07:00:00Z', 'amount': 7.29}, {'due_date': '2019-05-01T07:00:00Z', 'amount': 7.29}, {'due_date': '2019-05-01T07:00:00Z', 'amount': 7.29}, {'due_date': '2019-06-01T07:00:00Z', 'amount': 7.29}, {'due_date': '2019-06-01T07:00:00Z', 'amount': 7.29}, {'due_date': '2019-06-01T07:00:00Z', 'amount': 7.29}, {'due_date': '2019-06-01T07:00:00Z', 'amount': 7.29}, {'due_date': '2019-07-01T07:00:00Z', 'amount': 7.29}, {'due_date': '2019-07-01T07:00:00Z', 'amount': 7.29}, {'due_date': '2019-07-01T07:00:00Z', 'amount': 7.1}]",,,,to add stock of fruits and vegetables.
155,Fruits & Vegetables,,True,"[{'first_name': 'Prossy', 'last_name': '', 'gender': 'F', 'pictured': True}]",['en'],"Prossy is 22 years old and lives in the town of Kaliro, in the Iganga region of Uganda. For the past 2 years, Prossy has been working hard to manage her vegetables business, which sells tomatoes, eggplants, onions, and cabbages.<br /><br />To help expand her business, Prossy has requested a loan of 200,000 Ugandan Shillings from BRAC Uganda. The loan will be used to buy a bicycle to ease the transportation of vegetables and purchase more vegetables, which will help Prossy to generate greater profits. Then Prossy will be in a position to afford more basic needs and also improve on her standards of living, contribute to the respective bills for medication and also cater for her siblings and contribute to their respective school dues. Prossy hopes that in the future she will be able to buy  a plot of land and build a bricked house.<br /><br />Prossy is a member of BRAC's Empowerment and Livelihood for Adolescents (ELA) program. In addition to microfinance loans, the program provides both a safe place for young Ugandan women to take part in group activities, and a forum for life-skills training.",,,75,2018-05-26T08:49:49Z,1533440,2853476,1,0,0,3,75,Uganda,UG,town,1.043111 33.483191,point,Kaliro,Prossy,65,[],2018-06-25T08:10:02Z,2018-05-26T08:10:02Z,Food,funded,[],200000.0,UGX,2018-05-07T07:00:00Z,75,[],shared,0.1,lender,,7,[],"['Vulnerable Groups', 'Youth']",,,to purchase more vegetables and a bicycle for transportation.
