,activity,basket_amount,bonus_credit_eligibility,borrowers,description.languages,description.texts.en,description.texts.fr,description.texts.pt,funded_amount,funded_date,id,image.id,image.template_id,journal_totals.bulkEntries,journal_totals.entries,lender_count,loan_amount,location.country,location.country_code,location.geo.level,location.geo.pairs,location.geo.type,location.town,name,partner_id,payments,planned_expiration_date,posted_date,sector,status,tags,terms.disbursal_amount,terms.disbursal_currency,terms.disbursal_date,terms.loan_amount,terms.local_payments,terms.loss_liability.currency_exchange,terms.loss_liability.currency_exchange_coverage_rate,terms.loss_liability.nonpayment,terms.repayment_interval,terms.repayment_term,terms.scheduled_payments,themes,translator.byline,translator.image,use
44,Fruits & Vegetables,0.0,True,"[{'first_name': 'Rose ', 'last_name': '', 'gender': 'F', 'pictured': True}]",['en'],Rose is a mother of five children. She sells bananas to meet her family's needs and she now intends to add more stock of bananas using the loan to enable her to meet the demand. It is her first loan and she intends to pay back the loan from her profits. She dreams of educating her children to university level.,,,0,,1533643,2853745,1,0,0,0,350,Kenya,KE,town,0.232555 37.941375,point,Maua,Rose,386,[],2018-06-25T21:00:04Z,2018-05-26T21:00:04Z,Food,fundraising,[],35000.0,KES,2018-04-30T07:00:00Z,350,"[{'due_date': '2018-07-02T07:00:00Z', 'amount': 795.45}, {'due_date': '2018-07-09T07:00:00Z', 'amount': 795.45}, {'due_date': '2018-07-16T07:00:00Z', 'amount': 795.45}, {'due_date': '2018-07-23T07:00:00Z', 'amount': 795.45}, {'due_date': '2018-07-30T07:00:00Z', 'amount': 795.45}, {'due_date': '2018-08-06T07:00:00Z', 'amount': 795.45}, {'due_date': '2018-08-13T07:00:00Z', 'amount': 795.45}, {'due_date': '2018-08-20T07:00:00Z', 'amount': 795.45}, {'due_date': '2018-08-27T07:00:00Z', 'amount': 795.45}, {'due_date': '2018-09-03T07:00:00Z', 'amount': 795.45}, {'due_date': '2018-09-10T07:00:00Z', 'amount': 795.45}, {'due_date': '2018-09-17T07:00:00Z', 'amount': 795.45}, {'due_date': '2018-09-24T07:00:00Z', 'amount': 795.45}, {'due_date': '2018-10-01T07:00:00Z', 'amount': 795.45}, {'due_date': '2018-10-08T07:00:00Z', 'amount': 795.45}, {'due_date': '2018-10-15T07:00:00Z', 'amount': 795.45}, {'due_date': '2018-10-22T07:00:00Z', 'amount': 795.45}, {'due_date': '2018-10-29T07:00:00Z', 'amount': 795.45}, {'due_date': '2018-11-05T08:00:00Z', 'amount': 795.45}, {'due_date': '2018-11-12T08:00:00Z', 'amount': 795.45}, {'due_date': '2018-11-19T08:00:00Z', 'amount': 795.45}, {'due_date': '2018-11-26T08:00:00Z', 'amount': 795.45}, {'due_date': '2018-12-03T08:00:00Z', 'amount': 795.45}, {'due_date': '2018-12-10T08:00:00Z', 'amount': 795.45}, {'due_date': '2018-12-17T08:00:00Z', 'amount': 795.45}, {'due_date': '2018-12-24T08:00:00Z', 'amount': 795.45}, {'due_date': '2018-12-31T08:00:00Z', 'amount': 795.45}, {'due_date': '2019-01-07T08:00:00Z', 'amount': 795.45}, {'due_date': '2019-01-14T08:00:00Z', 'amount': 795.45}, {'due_date': '2019-01-21T08:00:00Z', 'amount': 795.45}, {'due_date': '2019-01-28T08:00:00Z', 'amount': 795.45}, {'due_date': '2019-02-04T08:00:00Z', 'amount': 795.45}, {'due_date': '2019-02-11T08:00:00Z', 'amount': 795.45}, {'due_date': '2019-02-18T08:00:00Z', 'amount': 795.45}, {'due_date': '2019-02-25T08:00:00Z', 'amount': 795.45}, {'due_date': '2019-03-04T08:00:00Z', 'amount': 795.45}, {'due_date': '2019-03-11T07:00:00Z', 'amount': 795.45}, {'due_date': '2019-03-18T07:00:00Z', 'amount': 795.45}, {'due_date': '2019-03-25T07:00:00Z', 'amount': 795.45}, {'due_date': '2019-04-01T07:00:00Z', 'amount': 795.45}, {'due_date': '2019-04-08T07:00:00Z', 'amount': 795.45}, {'due_date': '2019-04-15T07:00:00Z', 'amount': 795.45}, {'due_date': '2019-04-22T07:00:00Z', 'amount': 795.45}, {'due_date': '2019-04-29T07:00:00Z', 'amount': 795.65}]",shared,0.1,lender,Monthly,14,"[{'due_date': '2018-09-01T07:00:00Z', 'amount': 7.96}, {'due_date': '2018-09-01T07:00:00Z', 'amount': 7.96}, {'due_date': '2018-09-01T07:00:00Z', 'amount': 7.96}, {'due_date': '2018-09-01T07:00:00Z', 'amount': 7.96}, {'due_date': '2018-09-01T07:00:00Z', 'amount': 7.96}, {'due_date': '2018-10-01T07:00:00Z', 'amount': 7.96}, {'due_date': '2018-10-01T07:00:00Z', 'amount': 7.96}, {'due_date': '2018-10-01T07:00:00Z', 'amount': 7.96}, {'due_date': '2018-10-01T07:00:00Z', 'amount': 7.96}, {'due_date': '2018-11-01T07:00:00Z', 'amount': 7.96}, {'due_date': '2018-11-01T07:00:00Z', 'amount': 7.96}, {'due_date': '2018-11-01T07:00:00Z', 'amount': 7.96}, {'due_date': '2018-11-01T07:00:00Z', 'amount': 7.96}, {'due_date': '2018-12-01T08:00:00Z', 'amount': 7.96}, {'due_date': '2018-12-01T08:00:00Z', 'amount': 7.96}, {'due_date': '2018-12-01T08:00:00Z', 'amount': 7.96}, {'due_date': '2018-12-01T08:00:00Z', 'amount': 7.96}, {'due_date': '2018-12-01T08:00:00Z', 'amount': 7.96}, {'due_date': '2019-01-01T08:00:00Z', 'amount': 7.96}, {'due_date': '2019-01-01T08:00:00Z', 'amount': 7.95}, {'due_date': '2019-01-01T08:00:00Z', 'amount': 7.95}, {'due_date': '2019-01-01T08:00:00Z', 'amount': 7.95}, {'due_date': '2019-02-01T08:00:00Z', 'amount': 7.95}, {'due_date': '2019-02-01T08:00:00Z', 'amount': 7.95}, {'due_date': '2019-02-01T08:00:00Z', 'amount': 7.95}, {'due_date': '2019-02-01T08:00:00Z', 'amount': 7.95}, {'due_date': '2019-02-01T08:00:00Z', 'amount': 7.95}, {'due_date': '2019-03-01T08:00:00Z', 'amount': 7.95}, {'due_date': '2019-03-01T08:00:00Z', 'amount': 7.95}, {'due_date': '2019-03-01T08:00:00Z', 'amount': 7.95}, {'due_date': '2019-03-01T08:00:00Z', 'amount': 7.95}, {'due_date': '2019-04-01T07:00:00Z', 'amount': 7.95}, {'due_date': '2019-04-01T07:00:00Z', 'amount': 7.95}, {'due_date': '2019-04-01T07:00:00Z', 'amount': 7.95}, {'due_date': '2019-04-01T07:00:00Z', 'amount': 7.95}, {'due_date': '2019-05-01T07:00:00Z', 'amount': 7.95}, {'due_date': '2019-05-01T07:00:00Z', 'amount': 7.95}, {'due_date': '2019-05-01T07:00:00Z', 'amount': 7.95}, {'due_date': '2019-05-01T07:00:00Z', 'amount': 7.95}, {'due_date': '2019-06-01T07:00:00Z', 'amount': 7.95}, {'due_date': '2019-06-01T07:00:00Z', 'amount': 7.95}, {'due_date': '2019-06-01T07:00:00Z', 'amount': 7.95}, {'due_date': '2019-06-01T07:00:00Z', 'amount': 7.95}, {'due_date': '2019-06-01T07:00:00Z', 'amount': 7.96}]",,,,to add more stock of bananas.
45,Food Production/Sales,50.0,False,"[{'first_name': 'Doris ', 'last_name': '', 'gender': 'F', 'pictured': True}]",['en'],"Doris is a 61-year-old woman and has been selling kenkey (a traditional maize-based dish) for over a decade. A single mother with five children, Doris aspires to move from living in the same condition for over 30 years. Due to the lack of capital to increase her stock of maize, she has been unable to boost her output despite the high demand for the kenkey she sells. <br /><br />Doris will use this loan to buy stock in a large quantity and probably travel to the villages to buy it herself. She is hopeful that this will help boost stock and increase her profit significantly.<br /><br />Thank you, Kiva lenders, for supporting Doris' business!",,,0,,1533644,2853746,1,0,0,0,450,Ghana,GH,town,5.579233 -0.109043,point,Teshie,Doris,418,[],2018-06-25T21:00:04Z,2018-05-26T21:00:04Z,Food,fundraising,"[{'name': 'user_favorite'}, {'name': '#Woman Owned Biz'}, {'name': '#Elderly'}]",2000.0,GHS,2018-07-21T07:00:00Z,450,"[{'due_date': '2018-08-21T07:00:00Z', 'amount': 333.33}, {'due_date': '2018-09-21T07:00:00Z', 'amount': 333.33}, {'due_date': '2018-10-21T07:00:00Z', 'amount': 333.33}, {'due_date': '2018-11-21T08:00:00Z', 'amount': 333.33}, {'due_date': '2018-12-21T08:00:00Z', 'amount': 333.33}, {'due_date': '2019-01-21T08:00:00Z', 'amount': 333.35}]",shared,0.1,lender,Monthly,8,"[{'due_date': '2018-10-01T07:00:00Z', 'amount': 75}, {'due_date': '2018-11-01T07:00:00Z', 'amount': 75}, {'due_date': '2018-12-01T08:00:00Z', 'amount': 75}, {'due_date': '2019-01-01T08:00:00Z', 'amount': 75}, {'due_date': '2019-02-01T08:00:00Z', 'amount': 75}, {'due_date': '2019-03-01T08:00:00Z', 'amount': 75}]",['Rural Exclusion'],,,to buy more maize to make kenkey (a traditional dish) to sell and increase her income.
46,Arts,,True,"[{'first_name': 'Isaac', 'last_name': '', 'gender': 'M', 'pictured': True}, {'first_name': 'Deborah', 'last_name': '', 'gender': 'F', 'pictured': True}, {'first_name': 'Isaac', 'last_name': '', 'gender': 'M', 'pictured': True}, {'first_name': 'Cynthia', 'last_name': '', 'gender': 'F', 'pictured': True}]",['en'],"Isaac is a 42-year-old man who lives in Chorkor, a very busy area located in Accra, the capital of Ghana. He has lived there for some years in a compound house in his community. <br /><br />Isaac has taken out two loans with ID Ghana before. He is now applying for a loan to buy enough tools used to manufacture jewelry for sale.<br /><br />He is a member of the Brazil Group, which is composed of four members. His greatest strengths as an entrepreneur are his determination and commitment.",,,950,2018-05-26T23:30:24Z,1533533,2853553,1,0,0,14,950,Ghana,GH,town,5.528871 -0.24675,point,Chorkor,Brazil Group,231,[],2018-06-25T21:00:03Z,2018-05-26T21:00:03Z,Arts,funded,[],4300.0,GHS,2018-05-04T07:00:00Z,950,[],shared,0.1,lender,,7,[],,,,to buy enough tools for the manufacturing of jewelries to sell.
47,Dairy,0.0,True,"[{'first_name': 'Recho', 'last_name': '', 'gender': 'F', 'pictured': True}]",['en'],"Recho is a returning Kiva borrower who has an impeccable credit history. She lives in a small mud house in the Siongiroi area of Kenya. Despite a difficult living situation and general lack of access to the outside world (internet connection), she is a hardworking farmer. She began farming ten years ago. Today she has achieved great milestones in terms of diversifying beyond vegetable farming by introducing farm animals, such as dairy cows and poultry.<br /><br />Recho has managed to take care of her children with her income that comes from selling the milk from her cows. She has always wanted to take care of another dairy cow, but a lack of capital has prevented her from doing so. She is now seeking a loan to buy an additional dairy cow to improve her milk vending business. The cow she intends to buy is a breed that produces between 10-13 liters of milk a day. With this cow, she will produce more milk, which will translate into more income. Demand for milk in the Siongiroi area is high, but the supply is low. So, through this loan, Recho is going to have more milk and comfortably meet demand. <br /><br />Recho's vision is to keep even more dairy cows so that she will be able to build a bio digester, which would help her to save more energy.<br /><br />Be inspired this month and show a mom love by clicking the lend button!",,,0,,1533536,2853598,1,0,0,0,300,Kenya,KE,town,-0.89334 35.210726,point,Siongiroi,Recho,156,[],2018-06-25T21:00:03Z,2018-05-26T21:00:03Z,Agriculture,fundraising,"[{'name': 'volunteer_like'}, {'name': '#Animals'}]",30000.0,KES,2018-05-16T07:00:00Z,300,"[{'due_date': '2018-06-16T07:00:00Z', 'amount': 2123.19}, {'due_date': '2018-07-16T07:00:00Z', 'amount': 2185.24}, {'due_date': '2018-08-16T07:00:00Z', 'amount': 2249.1}, {'due_date': '2018-09-16T07:00:00Z', 'amount': 2314.83}, {'due_date': '2018-10-16T07:00:00Z', 'amount': 2382.48}, {'due_date': '2018-11-16T08:00:00Z', 'amount': 2452.11}, {'due_date': '2018-12-16T08:00:00Z', 'amount': 2523.78}, {'due_date': '2019-01-16T08:00:00Z', 'amount': 2597.53}, {'due_date': '2019-02-16T08:00:00Z', 'amount': 2673.45}, {'due_date': '2019-03-16T07:00:00Z', 'amount': 2751.58}, {'due_date': '2019-04-16T07:00:00Z', 'amount': 2831.99}, {'due_date': '2019-05-16T07:00:00Z', 'amount': 2914.72}]",shared,0.1,lender,Monthly,14,"[{'due_date': '2018-08-01T07:00:00Z', 'amount': 21.23}, {'due_date': '2018-09-01T07:00:00Z', 'amount': 21.85}, {'due_date': '2018-10-01T07:00:00Z', 'amount': 22.49}, {'due_date': '2018-11-01T07:00:00Z', 'amount': 23.15}, {'due_date': '2018-12-01T08:00:00Z', 'amount': 23.82}, {'due_date': '2019-01-01T08:00:00Z', 'amount': 24.52}, {'due_date': '2019-02-01T08:00:00Z', 'amount': 25.24}, {'due_date': '2019-03-01T08:00:00Z', 'amount': 25.98}, {'due_date': '2019-04-01T07:00:00Z', 'amount': 26.73}, {'due_date': '2019-05-01T07:00:00Z', 'amount': 27.52}, {'due_date': '2019-06-01T07:00:00Z', 'amount': 28.32}, {'due_date': '2019-07-01T07:00:00Z', 'amount': 29.15}]",['Rural Exclusion'],,,to buy an additional dairy cow to improve her milk vending business so that in the future she can build a bio digester that will help her produce clean energy.
48,General Store,0.0,False,"[{'first_name': 'Susan', 'last_name': '', 'gender': 'F', 'pictured': True}, {'first_name': 'Betty', 'last_name': '', 'gender': 'F', 'pictured': True}, {'first_name': 'Purity', 'last_name': '', 'gender': 'F', 'pictured': True}]",['en'],"Purity always strives for success no matter how difficult it may seem. She is married to a teacher and they are blessed with four children, three of whom are still in school.<br /><br />She commenced with a vegetable stall at her front yard in Unit A in 2014 which made her a visible and popular person in her neighborhood. This gave her an advantage that when the vegetable stall gave birth to a small grocery shop, there were less marketing efforts to employ, as many people were used to buying from her on a daily basis.<br /><br />She continued to grow her business though at a very slow pace as she used to face acute working capital shortages from time to time. This pushed her to look for financial leverage and they came to Thrive. With this knowledge, Purity is realizing notable improvement in her restocking level and profits. This enabled her to buy some property for her kitchen and paying fees for her children. Purity got $500 to restock more groceries for her small shop.",,,0,,1533645,2851920,1,0,0,0,1500,Zimbabwe,ZW,town,-18.019782 31.067907,point,Chitungwiza,White Horse Group,367,[],2018-06-25T21:00:03Z,2018-05-26T21:00:03Z,Retail,fundraising,[{'name': '#Repeat Borrower'}],1500.0,USD,2018-04-24T07:00:00Z,1500,"[{'due_date': '2018-05-25T07:00:00Z', 'amount': 250}, {'due_date': '2018-06-25T07:00:00Z', 'amount': 250}, {'due_date': '2018-07-25T07:00:00Z', 'amount': 250}, {'due_date': '2018-08-25T07:00:00Z', 'amount': 250}, {'due_date': '2018-09-25T07:00:00Z', 'amount': 250}, {'due_date': '2018-10-25T07:00:00Z', 'amount': 250}]",none,0.1,lender,Monthly,8,"[{'due_date': '2018-07-01T07:00:00Z', 'amount': 250}, {'due_date': '2018-08-01T07:00:00Z', 'amount': 250}, {'due_date': '2018-09-01T07:00:00Z', 'amount': 250}, {'due_date': '2018-10-01T07:00:00Z', 'amount': 250}, {'due_date': '2018-11-01T07:00:00Z', 'amount': 250}, {'due_date': '2018-12-01T08:00:00Z', 'amount': 250}]",['Youth'],Jacob Michaels,,to restock more groceries for her small shop.
49,Farming,0.0,False,"[{'first_name': 'Beatrice', 'last_name': '', 'gender': 'F', 'pictured': True}, {'first_name': 'Angelina', 'last_name': '', 'gender': 'F', 'pictured': True}]",['en'],"Beatrice is 62 years old, and is the married mother of six children who are still in school. She is a vegetable vendor; she plants and sells different vegetables, such as spinach, amaranth and cow peas. She has been running this business for 19 years, working every day from 6:30 a.m until 6:00 p.m. She earns profits from the business.<br /><br />This will be Beatrice's second loan request from Tujijenge Tanzania. She used her previous loan to purchase seeds and fertilizer for planting vegetables to sell in the market. She earned profits that she used to support her family and reinvest in her business, and she managed to repay the loan on time. <br /><br />She is applying for this loan to continue expanding her business by buying more vegetables seeds and fertilizers, as well as a big soaking tub to put her vegetables in for sale. Her dream is to become a large supplier of vegetables in the near future.<br /><br />Beatrice will share a portion of this loan with her fellow member of Kimusi Grp Tarime-Unit Group. They promise to pay back the loan.",,,0,,1533539,2853599,1,0,0,0,725,Tanzania,TZ,town,-1.467039 34.510612,point,Mara North,Kimusi Grp Tarime-Unit Group,87,[],2018-06-25T21:00:02Z,2018-05-26T21:00:02Z,Agriculture,fundraising,[{'name': '#Elderly'}],1650000.0,TZS,2018-05-14T07:00:00Z,725,"[{'due_date': '2018-05-21T07:00:00Z', 'amount': 22218.4}, {'due_date': '2018-05-28T07:00:00Z', 'amount': 22607.23}, {'due_date': '2018-06-04T07:00:00Z', 'amount': 23002.86}, {'due_date': '2018-06-11T07:00:00Z', 'amount': 23405.41}, {'due_date': '2018-06-18T07:00:00Z', 'amount': 23815.01}, {'due_date': '2018-06-25T07:00:00Z', 'amount': 24231.77}, {'due_date': '2018-07-02T07:00:00Z', 'amount': 24655.82}, {'due_date': '2018-07-09T07:00:00Z', 'amount': 25087.3}, {'due_date': '2018-07-16T07:00:00Z', 'amount': 25526.32}, {'due_date': '2018-07-23T07:00:00Z', 'amount': 25973.04}, {'due_date': '2018-07-30T07:00:00Z', 'amount': 26427.57}, {'due_date': '2018-08-06T07:00:00Z', 'amount': 26890.05}, {'due_date': '2018-08-13T07:00:00Z', 'amount': 27360.62}, {'due_date': '2018-08-20T07:00:00Z', 'amount': 27839.43}, {'due_date': '2018-08-27T07:00:00Z', 'amount': 28326.63}, {'due_date': '2018-09-03T07:00:00Z', 'amount': 28822.34}, {'due_date': '2018-09-10T07:00:00Z', 'amount': 29326.73}, {'due_date': '2018-09-17T07:00:00Z', 'amount': 29839.95}, {'due_date': '2018-09-24T07:00:00Z', 'amount': 30362.15}, {'due_date': '2018-10-01T07:00:00Z', 'amount': 30893.48}, {'due_date': '2018-10-08T07:00:00Z', 'amount': 31434.12}, {'due_date': '2018-10-15T07:00:00Z', 'amount': 31984.22}, {'due_date': '2018-10-22T07:00:00Z', 'amount': 32543.95}, {'due_date': '2018-10-29T07:00:00Z', 'amount': 33113.46}, {'due_date': '2018-11-05T08:00:00Z', 'amount': 33692.95}, {'due_date': '2018-11-12T08:00:00Z', 'amount': 34282.58}, {'due_date': '2018-11-19T08:00:00Z', 'amount': 34882.52}, {'due_date': '2018-11-26T08:00:00Z', 'amount': 35492.97}, {'due_date': '2018-12-03T08:00:00Z', 'amount': 36114.09}, {'due_date': '2018-12-10T08:00:00Z', 'amount': 36746.08}, {'due_date': '2018-12-17T08:00:00Z', 'amount': 37389.15}, {'due_date': '2018-12-24T08:00:00Z', 'amount': 38043.45}, {'due_date': '2018-12-31T08:00:00Z', 'amount': 38709.22}, {'due_date': '2019-01-07T08:00:00Z', 'amount': 39386.62}, {'due_date': '2019-01-14T08:00:00Z', 'amount': 40075.89}, {'due_date': '2019-01-21T08:00:00Z', 'amount': 40777.22}, {'due_date': '2019-01-28T08:00:00Z', 'amount': 41490.82}, {'due_date': '2019-02-04T08:00:00Z', 'amount': 42216.91}, {'due_date': '2019-02-11T08:00:00Z', 'amount': 42955.71}, {'due_date': '2019-02-18T08:00:00Z', 'amount': 43707.43}, {'due_date': '2019-02-25T08:00:00Z', 'amount': 44472.31}, {'due_date': '2019-03-04T08:00:00Z', 'amount': 45250.58}, {'due_date': '2019-03-11T07:00:00Z', 'amount': 46042.46}, {'due_date': '2019-03-18T07:00:00Z', 'amount': 46848.2}, {'due_date': '2019-03-25T07:00:00Z', 'amount': 47668.04}, {'due_date': '2019-04-01T07:00:00Z', 'amount': 48502.23}, {'due_date': '2019-04-08T07:00:00Z', 'amount': 49351.03}, {'due_date': '2019-04-15T07:00:00Z', 'amount': 50213.68}]",shared,0.1,lender,Monthly,13,"[{'due_date': '2018-07-01T07:00:00Z', 'amount': 9.76}, {'due_date': '2018-07-01T07:00:00Z', 'amount': 9.93}, {'due_date': '2018-08-01T07:00:00Z', 'amount': 10.11}, {'due_date': '2018-08-01T07:00:00Z', 'amount': 10.28}, {'due_date': '2018-08-01T07:00:00Z', 'amount': 10.46}, {'due_date': '2018-08-01T07:00:00Z', 'amount': 10.65}, {'due_date': '2018-09-01T07:00:00Z', 'amount': 10.83}, {'due_date': '2018-09-01T07:00:00Z', 'amount': 11.02}, {'due_date': '2018-09-01T07:00:00Z', 'amount': 11.22}, {'due_date': '2018-09-01T07:00:00Z', 'amount': 11.41}, {'due_date': '2018-09-01T07:00:00Z', 'amount': 11.61}, {'due_date': '2018-10-01T07:00:00Z', 'amount': 11.82}, {'due_date': '2018-10-01T07:00:00Z', 'amount': 12.02}, {'due_date': '2018-10-01T07:00:00Z', 'amount': 12.23}, {'due_date': '2018-10-01T07:00:00Z', 'amount': 12.45}, {'due_date': '2018-11-01T07:00:00Z', 'amount': 12.66}, {'due_date': '2018-11-01T07:00:00Z', 'amount': 12.89}, {'due_date': '2018-11-01T07:00:00Z', 'amount': 13.11}, {'due_date': '2018-11-01T07:00:00Z', 'amount': 13.34}, {'due_date': '2018-12-01T08:00:00Z', 'amount': 13.57}, {'due_date': '2018-12-01T08:00:00Z', 'amount': 13.81}, {'due_date': '2018-12-01T08:00:00Z', 'amount': 14.05}, {'due_date': '2018-12-01T08:00:00Z', 'amount': 14.3}, {'due_date': '2018-12-01T08:00:00Z', 'amount': 14.55}, {'due_date': '2019-01-01T08:00:00Z', 'amount': 14.8}, {'due_date': '2019-01-01T08:00:00Z', 'amount': 15.06}, {'due_date': '2019-01-01T08:00:00Z', 'amount': 15.33}, {'due_date': '2019-01-01T08:00:00Z', 'amount': 15.6}, {'due_date': '2019-02-01T08:00:00Z', 'amount': 15.87}, {'due_date': '2019-02-01T08:00:00Z', 'amount': 16.15}, {'due_date': '2019-02-01T08:00:00Z', 'amount': 16.43}, {'due_date': '2019-02-01T08:00:00Z', 'amount': 16.72}, {'due_date': '2019-02-01T08:00:00Z', 'amount': 17.01}, {'due_date': '2019-03-01T08:00:00Z', 'amount': 17.31}, {'due_date': '2019-03-01T08:00:00Z', 'amount': 17.61}, {'due_date': '2019-03-01T08:00:00Z', 'amount': 17.92}, {'due_date': '2019-03-01T08:00:00Z', 'amount': 18.23}, {'due_date': '2019-04-01T07:00:00Z', 'amount': 18.55}, {'due_date': '2019-04-01T07:00:00Z', 'amount': 18.87}, {'due_date': '2019-04-01T07:00:00Z', 'amount': 19.21}, {'due_date': '2019-04-01T07:00:00Z', 'amount': 19.54}, {'due_date': '2019-05-01T07:00:00Z', 'amount': 19.88}, {'due_date': '2019-05-01T07:00:00Z', 'amount': 20.23}, {'due_date': '2019-05-01T07:00:00Z', 'amount': 20.59}, {'due_date': '2019-05-01T07:00:00Z', 'amount': 20.95}, {'due_date': '2019-06-01T07:00:00Z', 'amount': 21.31}, {'due_date': '2019-06-01T07:00:00Z', 'amount': 21.69}, {'due_date': '2019-06-01T07:00:00Z', 'amount': 22.06}]",,,,"to continue expanding her business by buying more vegetables seeds and fertilizers, as well as a big soaking tub to put her vegetables in for sale."
